question,answer
How do core branches fare in placements?,Mechanical/Civil see 65-70% core placement. 35% opt for IT roles through campus upskilling programs. Average core package 竄ｹ6.8 LPA in 2024.
What's the startup placement scenario?,TBI incubator placed 85 startups in 2024. 12% graduates joined startups with average 竄ｹ7.2 LPA. Ola Electric hired 45 engineers for EV projects.
How many students pursue higher studies?,15% BTech graduates opt for MS/MBA. 60% secure admits in Top 200 QS universities with 竄ｹ25L average scholarship as per KIIT's PG cell reports.
What's the placement trend over 5 years?,Placement rate grew from 78% (2020) to 83% (2024). Average package increased 42% despite 24% rise in student intake as per AISHE data.
Are there placement blacklists for companies?,7 companies blacklisted in 2024 for delayed onboarding. Includes a FinTech firm that revoked 23 offers post-2025 controversies as per student petitions.
How transparent are placement statistics?,NIRF reports show 90% placement but exclude 20% non-participating students. Reddit users cite 70% actual job uptake as per anonymous surveys.
What's the lateral placement scenario?,"2,300+ lateral offers for 3-5 YOE roles. Amazon SDE-II offered 竄ｹ32 LPA to 45 alumni. Requires 7.5+ CGPA and certification proofs as per CDC."
How are international students placed?,12% international students achieved 65% placement. Top roles in Middle East IT firms with 竄ｹ10-15 LPA. Language barriers reported as key challenge.
What's the rural placement initiative?,Unnat Bharat Abhiyan placed 120 graduates in rural tech roles. 55% retention rate in village-level engineering projects as per 2024 CSR report.
Are there defense sector placements?,"DRDO recruited 7 students, HAL 12 in 2024. Requires GATE score + campus interview. Average package 竄ｹ9.8 LPA for defense PSU roles."
How does KIIT compare to NITs in placements?,KIIT reports 15% higher average than NIT Silchar (竄ｹ7.4 LPA) but 40% lower than NIT Trichy (竄ｹ14.2 LPA) as per NIRF 2024 data.
What's the placement cell's grievance process?,3-tier redressal system resolves 85% issues in 72hrs. 2024 saw 320 complaints mainly about offer delays and profile mismatches.
How many students get dream offers?,"1,700 'Dream Offers' in 2024 (竄ｹ10LPA+). Includes 45 Google STEP interns and 12 Microsoft Engage fellows as per placement report."
What's the M.Tech placement scenario?,72% placement with 竄ｹ7.8 LPA average. Specializations in AI/ML average 竄ｹ9.2 LPA. 18% pursue PhD through KIIT-DST scholarships.
Are there off-campus placement assists?,"CDC provides 25,000+ off-campus job alerts yearly. 12% students secure off-campus roles averaging 竄ｹ6.5 LPA as per 2024 tracker."
How effective are the coding clubs?,Topcoder Club members secured 35% higher packages. 18 students won Hackathons with direct recruitment offers from sponsoring companies.
What's the PSU placement record?,"ONGC recruited 7, NTPC 9 in 2024. Requires GATE 75+ percentile. Average PSU package 竄ｹ9.5 LPA with 100% job security as per reports."
How are economics graduates placed?,B.Sc Economics saw 68% placement. Top roles in FinTech (竄ｹ6.8 LPA) and analytics (竄ｹ7.2 LPA). 22% joined RBI through campus exams.
What's the law school placement rate?,KIIT Law reported 79% placement with 竄ｹ5.2 LPA average. Top recruiters: Cyril Amarchand (竄ｹ13 LPA) and Trilegal (竄ｹ11 LPA) in 2024.
Are there campus placement scams reported?,"2025 Reddit threads allege inflated stats - 30% offers counted as 'virtual'. University denies claims, cites audited reports."
How many students get product manager roles?,45 students placed as APMs in 2024. Requires 8.5+ CGPA and case study wins. Average package 竄ｹ14 LPA in healthtech startups.
What's the placement prep curriculum?,"600-hour mandatory course covering DSA, system design, and behavioral rounds. 82% students clear first technical rounds as per CDC."
How effective are mock interviews?,"3-round mock process improves selection rate by 55%. Ex-IITians conduct 25,000+ mocks annually with personalized feedback reports."
What's the internship stipend range?,竄ｹ8k-25k/month based on company. Microsoft Research offers 竄ｹ82k stipend for 6-month projects as per 2024 internship report.
Are there placement trends post-COVID?,25% increase in remote roles. 120 students placed in fully remote positions at US/EU startups averaging 竄ｹ10 LPA in 2024.
How many students opt for entrepreneurship?,"3.5% start ventures through TBI. 2024 saw 45 student startups - 12 in edtech, 8 in healthtech with 竄ｹ2cr total funding."
What's the placement scenario for Ph.Ds?,89% PhDs placed in academia/research. Average package 竄ｹ12.5 LPA. Top recruiters: DRDO (竄ｹ18 LPA) and IISc (竄ｹ9 LPA) as per 2024 data.
How are architecture graduates placed?,B.Arch saw 82% placement. Top firms: Hafeez Contractor (竄ｹ6.8 LPA) and Morphogenesis (竄ｹ5.9 LPA). 18% pursue overseas masters.
What's the MBA summer internship scenario?,"100% summer internships at KSOM. Average stipend 竄ｹ35k, highest 竄ｹ1.2 lakh at HUL. 65% convert to PPOs as per 2024 report."
Are there placement caps for companies?,No caps - Amazon made 184 offers in 2024. HighRadius leads with 850+ hires. 45 companies restricted to 5 offers each for diversity.
How many offers get revoked annually?,"2-3% offers revoked, mainly in startups. 2024 saw 23 revocations from a FinTech firm later blacklisted by placement cell."
What's the placement rate for girls?,87% female placement vs 81% male. 35% girls bagged 竄ｹ10LPA+ packages. Special scholarships for top-placed female engineers.
How are biotechnology students placed?,65% placement in pharma/research. Average 竄ｹ4.8 LPA. Top recruiter: Bharat Biotech (竄ｹ6.2 LPA). 30% opt for MS abroad.
What's the ECE placement scenario?,Electronics saw 89% placement. Top roles in VLSI (竄ｹ8.2 LPA) and IoT (竄ｹ7.8 LPA). 15% placed in core semiconductor roles.
Are there campus placement frauds?,2024 saw 3 fake companies exposed. 竄ｹ12 lakh recovered for 45 students through legal cell intervention as per annual report.
How many students get FAANG offers?,"12 FAANG offers in 2024: Amazon (9), Microsoft (3). Requires CodeChef 4-star+ rating and 8.5+ CGPA as per CDC data."
What's the mechanical engineering placement?,82% placement with 竄ｹ6.8 LPA average. Top roles in automotive (竄ｹ7.2 LPA) and HVAC (竄ｹ6.5 LPA). Tata Motors hired 35 students.
Are there government exam preparations?,UPSC/GATE cells train 450+ students annually. 2024 saw 12 ESE selections and 35 state engineering service recruits.
How does KIIT ensure placement fairness?,Double-blind recruitment process. 45 companies used AI proctoring in 2024. Grievance cell resolves profile mismatch issues.
What's the civil engineering placement rate?,78% placement with 竄ｹ5.9 LPA average. L&T Construction hired 28 students. 22% opt for higher studies in structural engineering.
Are there international internship options?,Erasmus+ offers 50 EU internships yearly. 2024 saw 12 students at CERN projects and 8 at German automotive firms.
How many startups recruit from KIIT?,"120+ startups participated in 2024. Notable hires: 15 at Ola Electric, 8 at Ather Energy with ESOPs worth 竄ｹ25L average."
What's the placement scenario for chemists?,B.Sc Chemistry saw 62% placement. Top roles in pharma QC (竄ｹ4.2 LPA) and FMCG R&D (竄ｹ5.1 LPA). 28% pursue MSc.
Are there placement constraints for backlogs?,Max 2 active backlogs allowed. 850 students with backlogs cleared got placed in 2024 through special placement drives.
How effective are the alumni referrals?,Alumni referred 450+ students in 2024. 68% conversion rate with average package 竄ｹ9.2 LPA vs campus average 竄ｹ8.5 LPA.
What's the renewable energy sector placement?,12% mechanical grads placed in solar/wind firms. Average 竄ｹ7.2 LPA. Top recruiter: ReNew Power with 18 offers in 2024.
Are there film/media studies placements?,"BA Film: 65% placement. 12 students joined Zee5, 8 with Netflix India. Average 竄ｹ4.8 LPA in content production roles."
How many get placed in consulting?,"18% MBA grads joined consulting. BCG recruited 2 at 竄ｹ19 LPA, Deloitte 15 at 竄ｹ9 LPA. Case study prep mandatory."
What's the placement rate for OBC students?,OBC candidates achieved 79% placement. 150+ companies followed caste-based quotas offering 850+ reserved seats in 2024.
Are there cybersecurity placements?,M.Tech Cyber Security: 88% placement. Average 竄ｹ9.8 LPA. Palo Alto recruited 7 students at 竄ｹ14 LPA in 2024.
How many students reject placement offers?,"15% reject for higher studies/startups. 2024 saw 120 offer declines - 60 for MS, 35 for entrepreneurship ventures."
What's the automotive placement scenario?,"Tata Motors (32), Maruti (18), and Mahindra (15) recruited in 2024. Average 竄ｹ7.5 LPA for automotive engineering roles."
Are there agricultural placements?,B.Sc Agri: 58% placement. 12 students joined ITC AgriBiz at 竄ｹ5.2 LPA. 25% work in organic farming startups.
How many get placed in finance roles?,12% MBA grads in IB/PE roles. Average 竄ｹ11 LPA. Ambit Capital recruited 3 students at 竄ｹ15 LPA through campus drives.
What's the hospitality management placement?,BHM saw 72% placement. Taj Group hired 15 at 竄ｹ4.8 LPA. 18% joined cruise lines with 竄ｹ6.2 LPA average.
Are there defense campus placements?,Indian Army recruited 8 through TGC. Average package 竄ｹ9.5 LPA. 45 students cleared SSB in 2024 as per SSB cell.
How many students get R&D roles?,22% MTech grads placed in R&D. DRDO (竄ｹ10 LPA) and CSIR (竄ｹ8.5 LPA) top recruiters. Requires published papers.
What's the fashion tech placement rate?,B.Des Fashion: 78% placement. 12 students joined Sabyasachi with 竄ｹ6.8 LPA. Export houses recruited 35 designers.
Are there sports quota placements?,5% seats reserved for athletes. 12 placed in sports tech firms like Spartan Pro with 竄ｹ5.5 LPA average in 2024.
How many pursue civil services?,UPSC cell reports 12 IAS/IPS selections in 2024. 450+ students appear for prelims annually with 8% success rate.
What's the nanotechnology placement?,M.Tech Nano: 65% placed in semiconductor firms. Average 竄ｹ8.2 LPA. 2 students joined TSMC through campus drives.
Are there animation industry placements?,B.Sc Animation: 62% placement. 8 students joined Prime Focus with 竄ｹ4.5 LPA. Freelance roles popular (38%).
How many get placed in core electrical?,68% EEE grads in core roles. Average 竄ｹ6.8 LPA. Top recruiters: Siemens (竄ｹ7.5 LPA) and Schneider (竄ｹ7.2 LPA).
What's the rural management placement?,"MBA Rural: 72% placement. Average 竄ｹ6 LPA. NABARD recruited 9, PRADAN 12 for field roles in 2024."
Are there music/dance program placements?,BA Odissi: 45% placement. 8 joined ICCR as performers. 22% start dance schools averaging 竄ｹ3.8 LPA revenue.
How many get placed in aviation?,B.Tech Aerospace: 12 placed in Air India Engineering. Average 竄ｹ7.8 LPA. 5 students joined drone startups.
What's the architecture internship scenario?,100% 6-month internships. Top firms: Hafeez Contractor (竄ｹ25k stipend) and Morphogenesis (竄ｹ20k) as per 2024 data.
Are there psychology placements?,MA Clinical Psych: 58% placed. Top roles in HR (竄ｹ5.2 LPA) and NGOs (竄ｹ4.5 LPA). 15% pursue PhDs.
How many join family businesses?,8% MBA grads (mostly from Gujarat/Rajasthan) join family ventures. Average turnover 竄ｹ5.8cr as per alumni surveys.
What's the renewable energy internship scene?,45 students interned at ReNew Power (竄ｹ18k stipend). 12 patents filed in solar tech during 2024 internships.
Are there placements in defense manufacturing?,L&T Defence recruited 7 mechanical grads at 竄ｹ8.2 LPA. Requires security clearance and no backlogs as per 2024.
How many get placed in UI/UX roles?,120 students placed as designers. Average 竄ｹ7.8 LPA. Top recruiter: Adobe (竄ｹ12 LPA) through design challenges.
What's the construction sector placement?,L&T Construction hired 28 civil engineers. Average 竄ｹ6.5 LPA. 15% get overseas postings in Gulf projects.
Are there placements in game development?,15 students joined Octro and Nazara. Average 竄ｹ6.2 LPA. 8 indie developers earned 竄ｹ4.8 LPA through self-publishing.
What percentage of KIIT faculty hold PhDs?,86% of full-time faculty possess PhDs as per NAAC 2024 report. 45% earned doctorates from QS Top 200 universities including MIT and Stanford.
How does KIIT evaluate teaching quality?,"Biometric attendance tracking, weekly student feedback via LMS, and 360° peer reviews. Top 10% teachers receive ₹5L annual research grants."
What administrative roles exist beyond teaching?,"1,200+ staff across 28 departments include wardens, registrars, and student counselors. Hostel wardens enforce 10 PM curfew and manage 15,000+ residents."
How many faculty members have industry experience?,62% faculty have 5+ industry years. Mechanical Engineering department leads with 80% ex-Tata Motors/Bosch professionals as per 2024 data.
What research output do KIIT faculty produce?,"14,745 Scopus papers (2024), h-index 121. 810+ patents filed with ₹125cr annual research funding from DST/DBT projects."
Are international faculty members employed?,"12% faculty are international - 45 from US/Germany, 30 from ASEAN nations. Specializes in AI and renewable energy research."
What training do staff receive annually?,200+ workshops on EdTech tools and mental health first aid. Administrative staff get ₹50k/year for certification programs.
How involved are faculty in curriculum design?,Industry Advisory Boards with 200+ experts update curricula biannually. 35% course content revised annually based on tech trends.
What's the student-faculty ratio?,15:1 as per NIRF 2024. Computer Science maintains 12:1 ratio while Humanities departments have 18:1.
Do faculty receive research incentives?,"₹5L for Q1 journal publications, ₹2L for patents. 45 faculty earned ₹1cr+ through commercialization royalties in 2024."
How many faculty are IEEE/ACM Fellows?,"18 IEEE Fellows, 9 ACM Distinguished Members. Lead 45 global conferences annually in IoT and cybersecurity domains."
What roles do associate deans perform?,"15 associate deans oversee academic audits, NAAC compliance, and interdisciplinary research. Report directly to Vice-Chancellor."
Are there faculty exchange programs?,Erasmus+ enables 50+ annual exchanges with EU universities. 120 faculty visited Germany's SRH Hochschule for curriculum benchmarking.
How does KIIT handle faculty promotions?,API-based system: 250 points for promotions. Requires 4 publications/year + ₹25L research grants. 65 professors promoted in 2024.
What mental health support exists for staff?,Free counseling at KIMS Hospital. 6-month sabbaticals for burnout recovery. 98% staff satisfaction in 2024 HR survey.
How many female faculty members are there?,38% female faculty - highest in Biotechnology (52%) and Law (48%). 15% hold leadership roles as deans/HODs.
What industry certifications do faculty hold?,450+ faculty have AWS/Azure certs. 120 certified in Six Sigma. Mechanical staff hold ASME/SAE professional memberships.
How are hostel wardens selected?,Senior professors with 10+ years experience. Manage 31 hostels with 150 support staff. 24/7 security and conflict resolution duties.
What's the faculty retention rate?,85% 5-year retention. ₹10L retention bonus for decade-long service. 12% attrition mainly for overseas opportunities.
Do faculty mentor startups?,TBI requires 5hr/week mentorship from 150+ faculty. 45 startups mentored to ₹1cr+ revenue in 2024.
How many faculty consult for industries?,"60% provide paid consultancy - average ₹15L/year extra. Top domains: Pharma (Dr. Reddy's), Automotive (Tata Motors)."
What language skills do faculty possess?,35% fluent in German/Japanese. 12 foreign language experts assist international students. Mandatory English proficiency tests.
Are there faculty awards at KIIT?,Annual Shiksha Ratna awards (₹5L prize). 2024 winners: Dr. A. Mohanty (AI research) and Dr. S. Das (Sustainable Materials).
How diverse are faculty qualifications?,"45% engineering, 30% sciences, 15% management PhDs. 10% interdisciplinary experts in AI+Healthcare fields."
What's the faculty publication requirement?,Minimum 2 Scopus papers/year. Top performers publish 8-10 papers. 23% faculty in Q1 journal editorial boards.
How are adjunct faculty involved?,200+ adjuncts from ISRO/DRDO teach specialized courses. 15 Nobel laureates visited through Distinguished Lecture Series.
What staff support exists for events?,"150-member Event Management Cell handles 500+ annual events. Includes tech support, logistics, and celebrity coordination."
How accessible are professors?,Mandatory 6hr/week office hours. 24/7 availability via LMS chat. Average response time: 22 mins as per student surveys.
What's the faculty disciplinary process?,Ethics Committee resolves 50+ cases/year. Penalties include suspension (15 cases in 2024) and research fund cuts.
Do faculty participate in CSR activities?,"Mandatory 10hr/month at KISS tribal school. 450+ faculty taught 15,000 tribal students STEM subjects in 2024."
How many faculty have international patents?,120+ US/EU patents held. Dr. R. Mishra's graphene battery tech licensed to BMW for ₹7cr in 2024.
What's the faculty recruitment process?,"National ads, 5-round interviews including demo lectures. 4,800 applicants for 120 positions in 2024 (4% selection rate)."
Are there faculty housing facilities?,800 on-campus quarters near academic blocks. Subsidized rent (₹5k/month for 3BHK). 45% faculty reside on campus.
How do faculty contribute to NAAC/NIRF?,"35 committees prepare 18,000+ documentation pages. 120 faculty involved in 2024 NAAC A++ accreditation process."
What's the faculty medical coverage?,₹5L insurance/year covering family. Free treatment at KIMS Hospital. 45 faculty underwent major surgeries in 2024.
How many faculty use innovative teaching?,70% employ flipped classrooms. 35% use VR simulations. 12 AI professors developed ChatGPT-based tutoring systems.
What staff support exists for research?,"250 research assistants, ₹25cr central equipment fund. 45 statisticians assist with data analysis."
Are faculty involved in alumni networks?,15% serve as KIITAA chapter advisors. Host 50+ global webinars/year. Facilitate 450+ industry referrals annually.
How many faculty review UGC materials?,12 serve on UGC syllabus committees. 45 review NCERT textbooks. 8 chair NBA accreditation teams for other universities.
What's the faculty gender pay gap?,4% gap as per 2024 audit. Female professors average ₹12.5L vs male ₹13L. Targeted elimination by 2026.
Do faculty get sabbaticals?,1-year paid sabbatical every 7 years. 45 faculty utilized in 2024 for overseas postdocs and book writing.
How many faculty speak at conferences?,85% present annually. 450+ international conference participations in 2024 with ₹25L average funding per trip.
What's the faculty patent filing process?,IPR cell files 120+ patents/year. 70% revenue share to inventors. Average 18-month grant period.
How are visiting faculty selected?,300+ annual visitors from Top 500 universities. Teach specialized courses like Quantum Computing (MIT's Dr. S. Aaronson).
What staff manage campus facilities?,"450 maintenance staff, 100 electricians, 75 horticulturists. IoT-enabled work order system resolves 95% requests in <4hrs."
How many faculty advise government bodies?,15 serve on NITI Aayog committees. 7 contribute to Odisha's AI policy. 3 advise UN SDG initiatives.
What's the faculty retirement policy?,Mandatory retirement at 65. 25% rehired as emeritus professors (₹1L/month) for mentorship roles post-retirement.
Are there faculty sports facilities?,"Exclusive gym, tennis courts, and swimming pool access. 65% faculty participate in annual staff sports meet."
How many faculty use open教育资源?,85% contribute to SWAYAM/NPTEL. 150 MOOCs created. 12 faculty won national OER awards in 2024.
What's the faculty child care support?,On-campus crèche (8AM-8PM). ₹2L/year childcare subsidy. 45 faculty children enrolled in KIIT Int'l School.
How many faculty are textbook authors?,"120+ published authors. Dr. M. Pattnaik's AI Ethics"" used in 50+ universities. Average royalties ₹15L/book."""
Do faculty get stock options?,Available only for TBI startups. 12 faculty hold equity in incubated firms. 3 became crorepatis via exits.
What's the faculty conference funding?,"₹2L domestic, ₹5L international per event. 450+ conferences attended in 2024 with 1,200+ papers presented."
How many faculty monitor exams?,"1,500+ invigilators for 100k+ exams/year. Biometric attendance with ₹5k penalty for lapses."
Are there faculty art initiatives?,Kala Manch club: 35 faculty artists. Annual exhibition sells 150+ works. Profits fund student scholarships.
What staff handle student grievances?,25 Ombudsman officers resolve 500+ cases/month. 92% satisfaction rate. Escalation to VC Office if unresolved.
How many faculty use AI teaching tools?,85% employ ChatGPT plugins. 35 developed KIIT-specific AI tutors. 12 face recognition systems track engagement.
What's the faculty community service?,"500+ faculty volunteer monthly at adopted villages. 2024 projects: digital literacy for 15,000 rural residents."
Are there faculty dance/music groups?,Sangeetika club: 45 members. Perform at KIIT Fest. Trained 120 students in classical arts in 2024.
How many faculty have dual appointments?,15 hold joint appointments with IITs/NITs. 7 work with German Fraunhofer Institute on renewable energy projects.
What staff manage international students?,"25-member Global Cell handles visas, cultural adaptation. 45 country-specific mentors speak 18 languages."
How many faculty review journals?,120 serve on editorial boards. Dr. S. Dasgupta edits Elsevier's AI journal (Impact Factor 8.9).
What's the faculty travel policy?,"Economy class for domestic, business for 8hr+ flights. 45 international trips/faculty/year average."
Are there faculty debate societies?,Vad Vivad group: 60 members. Won All India Inter-University Debate 2024. Hosts parliamentary-style debates.
How many faculty advise startups?,TBI mandates 2hr/week mentorship. 45 startups credited faculty guidance for funding success in 2024.
What's the faculty attendance requirement?,90% mandatory. ₹5k/day penalty for unapproved absences. Biometric logs at department gates.
Do faculty participate in rankings?,35 committees work year-round for NIRF/QS submissions. 120 faculty contributed data for 2024 rankings.
How many faculty are marathoners?,Running Club: 75 members. 12 completed Boston Marathon. Host annual 10K race raising ₹25L for charity.
What staff handle campus security?,500+ guards with 1500+ CCTV monitors. 12 ex-NSG commandos lead quick response teams. 45 women security officers.
How many faculty use social media teaching?,85% maintain YouTube channels. Dr. R. Das's ML tutorials have 250k subscribers. Integrated with LMS.
Are there faculty gardening initiatives?,"Green Faculty Club maintains 45 herb gardens. Supplies hostel kitchens. Won Best Green Campus"" 2024."""
What's the faculty retirement housing?,Silver Oaks Complex offers subsidized senior living. 25 retired faculty reside with medical alert systems.
How many faculty speak at TEDx?,18 TEDxKIIT speakers since 2015. 2024 talks on AI ethics and sustainable architecture garnered 2M+ views.
Do faculty get performance bonuses?,Up to ₹5L annually for 90%+ student feedback and 4+ publications. 120 faculty earned bonuses in 2024.
What staff manage transportation?,"150 drivers, 75 mechanics. Real-time tracking via KIIT app. EVs constitute 35% of fleet as per 2024 ESG report."
How many faculty consult for media?,35 regular panelists on DD National/NDTV. 12 write columns for The Hindu and Times of India.
Are there faculty book clubs?,Pustakalaya club meets weekly. 45 members. Hosts author interactions - 2024 guests included Amitav Ghosh.
What's the faculty disability support?,"Accessible offices, sign language interpreters. 8 faculty with disabilities receive ₹5L/yr assistive tech grants."
How many faculty members are alumni?,15% faculty are KIIT graduates. 45 pursued PhDs at alma mater. Special mentorship for alumni scholars.
Do faculty participate in hackathons?,45 faculty mentors guide 100+ student teams annually. 12 won national competitions with ₹25L+ prizes.
What staff handle academic audits?,50-member IQAC team conducts 10 surprise audits/month. 98% compliance rate in 2024 NAAC review.
How many faculty use AR/VR teaching?,120 employ Microsoft HoloLens. 35 developed metaverse classrooms. 12 patents filed in immersive education tech.
Are there faculty wellness programs?,"Free yoga (5AM-7AM), meditation sessions. 65% participation. 45 faculty reversed hypertension via campus initiatives."
What's the faculty alumni network?,KIIT Faculty Alumni Association with 800+ members. Annual grant of ₹25L for collaborative research projects.
How many faculty have Wikipedia pages?,12 notable faculty including Dr. A. Satapathy (renewable energy) and Dr. S. Mohanty (AI ethics) have Wikipedia entries.
Do faculty get stock photography access?,Free Shutterstock/Adobe Stock accounts. 850+ educational images created in 2024 for digital content.
What's the faculty continuing education?,₹2L/year allowance for online courses. 45 faculty completed MIT MicroMasters in 2024.
How many faculty advise student clubs?,Mandatory mentorship for 150+ clubs. 12 faculty-led clubs won national championships in 2024.
