question,answer
What's the lost ID replacement process?,竄ｹ500 fee at Registrar Office. Temporary ID issued within 2 hrs. Blocks old RFID immediately on reporting.
Does KIIT have dental facilities?,200-chair dental hospital with free checkups. Orthodontics costs 50% less than market rates for students.
Are there student-run cafes?,3 cafes managed by Entrepreneurship Club. Profits fund scholarships. Open 10 AM-9 PM.
What's the campus shoe repair?,2 cobblers near hostel blocks. Average cost 竄ｹ50-100. Free for SC/ST students with valid ID.
How many electrical substations?,18 substations with smart grid tech. Real-time usage dashboard accessible to faculty/researchers.
Are there vaccination centers?,"KIMS runs free vaccination drives for hepatitis, HPV, etc. International students get travel vaccines at cost."
What's the sports equipment issue?,"Valid ID required. 竄ｹ5,000 deposit for premium gear. Tennis balls issued free, rackets 竄ｹ100/hr."
Does KIIT have a printing quota?,"500 free pages/semester. Additional pages 竄ｹ0.50 b/w, 竄ｹ2 color. 24-hr print centers in library and hostels."
Are there dark rooms for photography?,4 B/W dark rooms with enlargers. Chemistry Dept. supplies developers at subsidized rates.
What's the policy on rainwater harvesting?,Mandatory in all new buildings. 65 million liter capacity. 40% of non-potable needs met through rainwater.
Are there phone charging stations?,Solar-powered charging kiosks at 28 locations. Supports all port types. Free service.
How many emergency exits per building?,Minimum 6 exits in academic blocks. Marked with glow strips. Drills conducted bi-annually.
What's the campus night lighting?,"15,000 LED lights with motion sensors. Security patrols 24/7. Blue light emergency poles every 100m."
Are there alumni guesthouses?,"5-star KIIMS guesthouse (竄ｹ3,000/night). 50% discount for students' parents. Prior booking required."
What's the policy on posters/flyers?,Approval needed from Student Council. Maximum 50 A4 sheets per event. Eco-friendly inks mandatory.
Does KIIT have a lost device tracker?,IT dept. tracks Apple/Android devices connected to campus WiFi. Recovery success rate 82%.
Are there meditation gardens?,7 Japanese Zen gardens with soundproof domes. Open 5 AM-8 PM. Guided sessions every Sunday.
What's the campus footwear cleaning?,Auto-shoe polishers at all building entrances. Free service. Usage logged via student ID.
How many water coolers exist?,450+ RO water coolers with chilled/normal options. Monthly TDS reports displayed nearby.
Are there student art supplies?,"Stationery store sells 50% subsidized art materials. Annual limit 竄ｹ5,000 per student."
What's the policy on power outlets?,"Hostels have 3 sockets/room. Overloading circuits leads to 竄ｹ2,000 fine and disciplinary action."
Does KIIT have a observatory?,6-inch refractor telescope at Science Block. Open every Friday 7-9 PM. Astronomy Club membership required.
Are there massage chairs?,12 chairs in Wellness Center. Free 15-min sessions twice/month. Prior booking via app.
What's the campus sanitation score?,"4.8/5 in Swachh Campus rankings. 350 sanitation workers, 85% waste recycled. Daily inspections."
How many emergency vehicles?,"12 ambulances, 3 fire tenders, 5 security patrol SUVs. Average response time <4 mins."
Are there smart bins?,350 IoT-enabled bins send fill-level alerts. Earn 10 reward points per kg recyclables deposited.
What's the policy on umbrella sharing?,Free umbrella rentals at 15 stands. 竄ｹ100/day late fee. Must return within 48 hrs.
Does KIIT have a lost book policy?,Pay 150% of book's value or replace with new copy. Maximum 3 lost items/year allowed.
Are there photocopy services?,28 licensed shops (竄ｹ0.25/page). Copyrighted material requires faculty permission slip.
What's the campus noise policy?,Silent zones in library/health center. Hostels: 55dB max after 10 PM. Decibel meters enforced.
How many CCTV cameras?,"5,250 cameras with 45-day storage. Face blurring in public areas for privacy. Access requires Dean's approval."
Are there student gardening plots?,Organic farming plots (2 acres) available. Produce sold in campus stores. Apply via Agri Club.
What's the policy on 3D printing?,Free 500g filament/semester. Commercial use requires IPR clearance. 24-hr access to Maker Labs.
Does KIIT have a patent center?,"Yes, files 250+ patents/year. Students get 70% revenue share. Prior art search free for KIIT projects."
Are there virtual reality labs?,12 VR pods for engineering/medical training. Book via department (max 2 hrs/session).
What's the campus map accuracy?,Interactive map on KIIT app updates every 15 mins. Shows real-time bus locations and facility wait times.
What is KSAC at KIIT?,"KSAC (KIIT Student Activity Centre) coordinates 28+ student societies including drama, debate, and robotics clubs. It hosts annual events like Kritarth and manages 150+ weekly extracurricular activities across campuses."
How many cultural fests does KIIT host annually?,"KIIT organizes 3 major fests: KIIT Fest (Feb), Kritarth (Dec), and Kalinga Literary Festival (Oct). Over 15,000 students participate in 100+ events spanning dance, music, and tech competitions."
What sports facilities are available?,"Campus features Olympic-size swimming pool, 10 tennis courts, rugby field, and 25,000-seat cricket stadium. Sports scholarships cover 50-100% fees for national-level athletes."
How does KIIT support mental health?,Free counseling services through KIMS Hospital with 15+ therapists. 24/7 mental health helpline and mandatory stress management workshops every semester.
What unique clubs exist at KIIT?,"Specialized clubs include Kalliope (poetry slam), Keurig (culinary arts), and DroneTech (UAV development). Members get industry mentorship and competition funding up to 竄ｹ2 lakh."
Are there international student exchanges?,KIIT offers semester exchanges to 52 universities globally. 500+ students participate annually through Erasmus+ and SAARC scholarship programs.
What's KIIT Fest?,"5-day annual cultural fest attracting 50,000+ participants. Features Bollywood performances, hackathons, and 竄ｹ50 lakh prize pool. 2024 theme was 'Tech Renaissance'."
How active is the NCC at KIIT?,"NCC has 200 cadets with 3 units (Army, Navy, Air Force). Offers mountaineering expeditions, Republic Day camp selections, and military service credits."
What entrepreneurship support exists?,"TBI incubator hosts 85+ student startups. Provides seed funding up to 竄ｹ25 lakh, patent filing support, and access to 200+ industry mentors."
Are there hostel cultural activities?,"31 hostels organize weekly 'Antaranga' events - talent shows, cooking competitions, and themed parties. Best hostel awarded 竄ｹ5 lakh annual grant."
What's unique about Kritarth fest?,Social impact-focused fest with 竄ｹ1 crore charity drive. 2024 edition featured sign language performances and assistive tech exhibitions by students.
How to join student councils?,"Elections held every October for 45 positions. Requires 8.0+ CGPA and no disciplinary record. Campaign budget capped at 竄ｹ50,000."
What language clubs exist?,"12 language clubs including Japanese (JLPT prep), German (Goethe tie-up), and Sanskrit. Members get free certification exam vouchers."
Are there inter-hostel competitions?,Annual 'Samudra Manthan' features 50+ sports/cultural events. Winning hostel gets 竄ｹ10 lakh infrastructure upgrade budget.
What tech clubs are popular?,"Robotics Club (ranked 3rd nationally), AI Nexus (Microsoft partnered), and Blockchain Brigade. Members get free Azure/GCP credits."
How accessible are sports facilities?,24/7 access with student ID. Equipment rental: 竄ｹ100/day for premium gear. Mandatory safety certification for adventure sports.
What cultural diversity initiatives exist?,"International Food Fest (65+ cuisines), Bhasha Utsav (regional language workshops), and Interfaith Harmony Week with 30+ events."
How does KIIT handle ragging?,Zero-tolerance policy with 500+ CCTV cameras in hostels. Anti-ragging committee resolves complaints within 48 hours. 100% compliance since 2022.
What art facilities are available?,"Kala Bhavan art complex has pottery studios, silk-screen printing, and digital art labs. Open access 10 AM-8 PM daily."
Are there student-run media?,"Campus Radio 90.8FM, KIIT Times newspaper (15,000 circulation), and KTV YouTube channel (50k subs). Offers internships with Times Group."
What leadership programs exist?,Yuva Utkarsh' initiative offers 6-month leadership training. Includes IIM faculty workshops and UN model diplomacy simulations.
How active is the NSS at KIIT?,"2,500+ NSS volunteers annually conduct literacy drives, blood donation camps, and rural tech adoption projects across Odisha."
What's the campus nightlife like?,"9 PM-12 AM: Library access, 24/7 cafes, and moonlight sports. Security-approved off-campus outings allowed twice/month for seniors."
Are there co-ed hostels?,"No separate co-ed hostels. Gender-specific blocks with common interaction zones. Curfew: 10 PM for UG, 12 AM for PG students."
What music facilities exist?,"30 practice rooms with instruments, recording studio (竄ｹ500/hr), and annual Western Music Fest with Saregama collaborations."
How to start a new club?,Submit proposal to KSAC with 50+ signatures. 竄ｹ25k seed funding provided. Must maintain 4+ events/semester for renewal.
What career services are offered?,Dedicated CDC with 45 counselors. Conducts 50+ mock interviews/week and personality mapping through IBM Watson AI tools.
Are there stand-up comedy events?,Monthly 'HaHa KIIT' open mic nights. Winners perform at KIIT Fest. Famous alumni include Comicstaan semi-finalist Rohan Guha.
What's the policy on political activism?,Non-partisan campus. Allows issue-based protests with prior permission. Banned organizations list includes 12 groups.
How green is the campus?,40% green cover with Miyawaki forests. 100% organic waste recycling. Solar-powered golf carts for inter-campus transport.
What unique festivals are celebrated?,"Holi: 3-day 'Rang Mahotsav', Diwali: 1,000+ diya installation record, Christmas: Europe-style winter market with ice skating rink."
Are there dating spaces on campus?,7 'Chit-Chat Zones' with coffee kiosks. Couple-friendly seating in central library. Relationship counseling available through KIMS.
What gaming facilities exist?,Esports Arena with 50 high-end PCs. Hosts BGMI tournaments with 竄ｹ5 lakh prizes. VR lab open for metaverse development projects.
How active are alumni networks?,"150+ city chapters globally. Mentorship portal with 5,000+ registered alumni. Annual homecoming fest with venture pitch sessions."
What dance forms are taught?,"Free classes in Odissi, Kathak, Hip-Hop, and Salsa. Performance teams tour nationally - 2024 winner of NH7 Dance Battle."
Are there book clubs?,"25+ subject-specific reading groups. 'Bibliophiles Anonymous' exchanges 5,000+ books/month. Author meetups every quarter."
What photography opportunities exist?,Kreative Eye society loans Canon/Nikon gear. Hosts NatGeo workshops. Annual 'Through the Lens' contest with 竄ｹ2 lakh prize.
How to access mental health resources?,Anonymous counseling through UniCare app. 10 free sessions/semester. Crisis intervention team responds within 30 minutes.
What's the startup incubation process?,Apply via TBI portal. 6-month program with 竄ｹ5 lakh stipend. Demo Day connects with 100+ investors like Accel and Sequoia.
Are there TEDx events?,TEDxKIIT hosted annually with 15 speakers. 2024 theme: 'Reimagining Education'. Livestreamed to 50+ countries.
What's the coding culture like?,24/7 hackathons at Code Nest lab. 300+ active GitHub contributors. Placement prep via LeetCode/KIIT coding marathon platform.
How diverse is the student body?,12% international students from 65 nations. 45% female enrollment. 8 LGBTQ+ student groups with dedicated hostels.
What's the food scene on campus?,"15 food courts offering Odia, Continental, and NE Indian cuisines. Health tracker integration for personalized meal plans."
Are pets allowed in hostels?,Only service animals permitted after medical certification. Campus has 3 pet parks with grooming stations and vet kiosks.
What's the transportation system?,150 AC buses on 38 routes. E-rickshaw shuttle every 10 mins. Bike rentals (竄ｹ50/hr) with GPS tracking.
How active is the theater scene?,Kalakaar society produces 12 plays/year. Collaborates with NSD. 2024 adaptation of 'Hamlet' toured 7 states.
What's the anime/manga culture?,"Otaku Club with 1,200 members. Hosts Cosplay Parades and Japan Foundation-sponsored manga drawing workshops."
Are there scholarships for artists?,Kala Prativa Scholarship: 50% fee waiver for national art competition winners. 120 students benefitted in 2024.
What's the gym facility like?,6 AC gyms with CrossFit zones. Free personal trainers for 8.5+ CGPA students. Open 5 AM-11 PM.
How to report harassment?,SHE-Box app with direct VC access to Women's Cell. Guaranteed resolution in 72 hours. 98% case closure rate in 2024.
What's the debate circuit like?,Kronicle society ranked 2nd nationally. Members get stipends for Asian/World Universities Debating Championships.
Are there stargazing facilities?,Astronomy Club access to 16-inch telescope. Night sky watches every Friday. NASA guest lectures quarterly.
What's the fashion show scene?,KIIT Fashion Week attracts 50+ designers. Student designers get 竄ｹ5 lakh production grants. 2024 show featured Tarun Tahiliani.
How to join sports teams?,Trials conducted in July. 35+ university teams. Compulsory 75% attendance in practice sessions.
What's the campus safety ranking?,A++ in NIRF safety audit. 500+ CCTV cameras with AI analytics. Women's safety index: 9.7/10 (2024).
Are there podcasting studios?,3 soundproof podcast booths in library. Equipment loan includes Rode mics and Zoom recorders. iTunes featured 12 student podcasts.
What's the filmmaking support?,KIIT Film Fund provides 竄ｹ10 lakh for student projects. Annual film fest judged by Shoojit Sircar and Anurag Kashyap.
How active is the LGBTQ+ alliance?,"Rainbow Collective hosts Pride Parade (1,500+ participants). Gender-neutral facilities in 15 campus buildings."
What's the yoga infrastructure?,7 shalas with certified instructors. Offers free 200-hr YTT certification. Hosts National Yoga Olympiad annually.
Are there coding competitions?,"KIIT International Coding Challenge (KICC) with 竄ｹ50 lakh prize pool. 2024 had 25,000+ global participants."
What's the music festival scene?,Echoes (EDM fest) and Swaradhun (classical) attract 20k+ attendees. Past performers include AR Rahman and Nucleya.
How to access academic help?,24/7 TutorBot AI assistant. Peer tutoring hub with 300+ student tutors. Professor office hours via appointment app.
What's the stand-up paddleboarding facility?,Artificial lake with 15 boards. Certified instructors from Odisha Adventure Sports Association. Free access on weekends.
Are there AI research opportunities?,Center for AI offers paid internships from 2nd year. 45 students published in IEEE/Springer journals in 2024.
What's the gaming lounge like?,VR zone with Oculus Rift and HTC Vive. Hosts fortnightly LAN parties. Game development lab using Unreal Engine 5.
How to join the mountaineering club?,Basic training at Dhauladhar ranges. Advanced expeditions to Nepal. 100% scholarship for female climbers.
What's the poetry scene like?,Kavya Kunj society publishes quarterly journal. Slam poetry battles with 竄ｹ1 lakh prize. Javed Akhtar conducted 2024 workshop.
Are there aeromodelling facilities?,Aero Club designs UAVs for ISRO challenges. Members won 2024 International Drone Racing Championship in Dubai.
What's the social media reach?,Official handles have 2M+ followers. Student influencers get brand deals via KIIT Creator Marketplace ( 竄ｹ25 lakh+ earned in 2024).
How active is the quizzing circuit?,Qutopia society won 23 national titles in 2024. Hosts Asia's largest open quiz with 竄ｹ10 lakh prize money.
What's the alumni mentorship program?,"GuideWire' platform connects students with 15,000+ alumni. 1:1 video mentoring and internship referrals."
Are there paid leadership roles?,Campus Ambassador program pays 竄ｹ15k/month. 200+ positions including event managers and tech evangelists.
What's the rural immersion program?,Mandatory 2-week village stay with social projects. 2024 initiatives included solar electrification of 7 Odisha villages.
How to access 3D printing?,Maker Lab offers free 500g filament/month. Training on Stratasys J750 Dental printers. 竄ｹ100/hr for commercial projects.
What's the martial arts facility?,Taekwondo dojo with Kukkiwon-certified instructors. Members won 7 golds at 2024 National University Games.
Are there stock trading facilities?,Virtual trading lab with Bloomberg terminals. Collegiate Portfolio Challenge with 竄ｹ5 lakh seed funding for top traders.
What's the architecture exhibition?,Annual ArchExpo showcases student projects. 2024 theme 'Sustainable Smart Cities' attended by PM Modi.
How to join the music band?,Auditions every semester for 8 genre-based bands. Equipment provided includes Fender guitars and Yamaha drums.
What's the foreign internship scene?,"35% students secure global internships. Top destinations: Germany (DAAD scholarships), Japan (JASSO), and Singapore."
Are there TED-style talks?,KIIT Talks feature alumni like Flipkart CTO. 18-25 age category speakers get 竄ｹ50k stipend per talk.
What's theadventure sports policy?,Mandatory insurance for high-risk activities. 45 certified instructors across 12 adventure disciplines.
How active is the photography club?,Kreative Eye organizes monsoon photography treks. Members exhibited at India Art Fair 2024.
What's the literary magazine?,"The Kalinga Review publishes student writings. ISSN-certified. 5,000 print copies distributed nationally."
Are there paid research assistant roles?,200+ positions across 28 departments. Stipend: 竄ｹ15k-竄ｹ25k/month. 85% assistants publish papers in Scopus journals.
What's the dance therapy program?,"Weekly sessions for stress relief. Collaboration with NIMHANS. 1,200+ participants in 2024."
How to access legal aid?,Free services through KIIT Legal Cell. 50+ practicing lawyers mentor students. Handled 320 cases in 2024.
What's the campus fashion trend?,Design students launch 12 sustainable clothing lines annually. KIIT-branded eco-friendly merchandise sold globally.
Are there astronomy courses?,Credit courses on astrophysics and cosmology. Field trips to Nainital Observatory. Student discovered 3 asteroids in 2024.
What's the public speaking support?,Toastmasters Club with 8 certified trainers. Hosts national-level MUN with UNHRC case simulations.
How to join the film society?,Cinephiles Club screens 100+ indie films/year. Members get passes to KIFF and IFFI. 2024 guest: Anurag Basu.
What's the green campus initiative?,Electric vehicle-only zones. 5MW solar power generation. Carbon-negative certification target by 2026.
Are there paid campus jobs?,"500+ positions in library, labs, and admin. Max 20 hrs/week. Minimum wage 竄ｹ150/hr as per state laws."
What's the robotics competition scene?,Team Humanoid ranked 4th globally at RoboCup 2024. Annual robo-war with 竄ｹ25 lakh prize pool.
How active is the coding for good initiative?,Tech4Society hackathon solves rural issues. 2024 winner developed AI-based TB detection tool deployed in 7 states.
What's the stand-up comedy circuit?,HaHa KIIT Open Mic winner gets Netflix India audition. 2024 finalists performed at Canvas Laugh Club.
Are there Bollywood dance workshops?,Choreo Connect society hosts Shiamak Davar instructors. Members performed at IPL 2024 opening ceremony.
What's the LGBTQ+ support system?,"Rainbow Collective offers gender affirmation fund (竄ｹ50k), legal aid, and campus pride marches with police protection."
How to access foreign journals?,"Library subscribes to 35,000+ journals via IEEE, Springer, JSTOR. Remote access through VPN for off-campus use."
What's the campus podcasting scene?,12 student-led shows on Spotify. Studio access free for academic podcasts. 'Startup Charcha' ranked #3 in EduTech category.
Are there AI ethics courses?,Mandatory 2-credit course 'Responsible AI' for tech students. Includes case studies on algorithmic bias mitigation.
What's the rural management program?,MBA students implement projects in 50 villages. 2024 initiatives increased farmer incomes by 40% through FPOs.
How active is the chess club?,KIIT Grandmasters team won All India University Championship 2024. Hosts simul matches with Viswanathan Anand.
What's the disaster management training?,"Mandatory 3-day workshop with NDRF. Includes mock drills for earthquakes, floods, and cyberattacks."
Are there paid artistic residencies?,Kala Vatika offers 6-month residencies with 竄ｹ50k stipend. 2024 artists exhibited at Jehangir Art Gallery.
What's the language exchange program?,Tandem Learning Hub pairs 500+ students for 30 language exchanges. Earn credits through conversation logs.
How to join the mountaineering club?,Basic training at Dhauladhar ranges. Advanced expeditions to Nepal. 100% scholarship for female climbers.
What is KIIT's NAAC accreditation status?,KIIT holds NAAC A++ accreditation - the highest grade with 3.62 CGPA. Valid until 2027. Covers all 28 schools under UGC norms.
How does KIIT rank in NIRF 2024?,Ranked 15th among Indian universities in NIRF 2024. 37th in Engineering category. Scored 58.32/100 in teaching and research parameters.
What international ranking does KIIT hold?,Ranked 601-800 in THE World University Rankings 2024. Computer Science program ranked 301-400 globally by THE Subject Rankings 2025.
Is KIIT NBA accredited?,Yes. 13 B.Tech programs hold NBA Tier-I accreditation under Washington Accord. Valid until 2026 for international recognition.
What's KIIT's ARIIA ranking?,Ranked 1st in ARIIA 2021 innovation rankings among private universities. Scored 86/100 for startup ecosystem and patents filed.
How does KIIT rank in QS Asia rankings?,Ranked 168th in THE Young University Rankings 2024. QS Asia University Rankings 2025 places KIIT in 351-400 band.
What's KIIT's NIRF management ranking?,Ranked 67th in Management category (NIRF 2024). MBA program accredited by AACSB with 85% placement rate.
Does KIIT have ABET accreditation?,Yes. Computer Science & IT programs hold ABET accreditation since 2019. Recognized in USA/Canada/Middle East.
What's KIIT's EduRank global position?,"Ranked 50th in India, 2219th globally by EduRank 2025. Top 25% in 102 research areas including Data Science."
How does KIIT rank in Odisha?,1st in Odisha as per NIRF 2024. State's only university with NAAC A++ and 15+ international accreditations.
What's KIIT's THE Impact Ranking?,201-300 in THE Impact Rankings 2024 for SDG implementation. Top performer in Quality Education (SDG4) initiatives.
Is KIIT UGC recognized?,Yes. Declared Deemed University under Section 3 of UGC Act 1956. All programs follow UGC CBCS system.
What's KIIT's NIRF research score?,"Scored 22.45/30 in Research NIRF 2024. Published 14,745 papers with 150,095 citations as per EduRank data."
How does KIIT rank for innovation?,ARIIA 2021 ranked KIIT 1st for innovation. Filed 250+ patents annually with 70% student revenue share.
What's KIIT's architecture ranking?,B.Arch ranked 45th in India (NIRF 2024). COA accredited with 100% placement in top firms like Hafeez Contractor.
Is KIIT accredited for medical programs?,KIMS Medical College holds MCI recognition. MBBS program ranked 28th in India (NIRF 2024 Health category).
What's KIIT's law school ranking?,School of Law ranked 19th in India (NIRF 2024). BA LLB program accredited with BCI and UGC norms.
How does KIIT rank in employability?,THE Global Employability Rank 601+. 95% placement rate with 700+ recruiters in 2024 campus drives.
What's KIIT's PhD ranking?,Ranked 48th in India for research (NIRF 2024). Offers PhD in 42 disciplines with 竄ｹ25k/month stipend.
Is KIIT AICTE approved?,All technical programs approved by AICTE. 12 schools hold additional ISO 9001:2015 certification.
What's KIIT's sports ranking?,Awarded Rashtriya Khel Protsahan Puruskar 2022. 23 Olympians trained. Sports scholarship covers 100% fees.
How does KIIT rank for internationalization?,THE World Rankings 2024: 58/100 international outlook. Hosts 12% foreign students from 65+ countries.
What's KIIT's dental college ranking?,KIDS Dental College ranked 31st in India (NIRF 2024). BDS program accredited by DCI with 200-chair hospital.
Is KIIT recognized by WHO?,KIMS Hospital is WHO-collaborated center. Medical programs follow WFME global standards.
What's KIIT's nursing ranking?,B.Sc Nursing ranked 22nd in India (NIRF 2024). INC accredited with 1000-bed hospital training facility.
How does KIIT rank in CSR?,1st in India Today CSR Rankings 2024. 5% revenue allocated to KISS tribal education initiatives.
What's KIIT's QS subject ranking?,QS World Rankings 2025: 551-600 for Computer Science. 601-650 for Engineering & Technology.
Is KIIT recognized by WES?,Yes. All degrees recognized by World Education Services for US/Canada immigration since 2018.
What's KIIT's agricultural ranking?,Ranked 238th globally for Agricultural Engineering (EduRank 2025). Offers B.Sc Agriculture with ICAR linkage.
How does KIIT rank in sustainability?,UI GreenMetric Rank 201-300 globally. 40% green cover with 8.9MW solar power on campus.
What's KIIT's IEEE ranking?,Top 10% contributor to IEEE Xplore in India. 450+ papers published in IEEE journals annually.
Is KIIT part of Erasmus+?,Yes. Erasmus+ mobility program with 52 EU universities. 500+ student exchanges annually.
