question,answer
What's KIIT's Incubation ranking?,Ranked 7th in India (AICTE 2024). TBI incubator hosts 85 startups with 竄ｹ25L seed funding.
How does KIIT rank in patents?,Ranked 15th in India for patents filed (IPIndia 2024). 1200+ patents granted since 2010.
What's KIIT's IEEE student branch rank?,No.1 IEEE student branch in Asia-Pacific 2023. 150+ projects showcased at international conferences.
Is KIIT GATE recognized?,GATE scores valid for M.Tech admissions. 2024 cutoff: 550 for CSE. 25% seats reserved for KIIT alumni.
What's KIIT's architecture research rank?,Top 5% in ARCASIA research index. 45 sustainable design patents filed in 2024.
How does KIIT rank in moot courts?,Law school ranked 3rd nationally in moot court wins (2024). Hosts KLAC with 竄ｹ10L prize pool.
What's KIIT's NPTEL ranking?,"Top 1% contributor to NPTEL courses. 25,000+ course enrollments with 85% certification rate."
Is KIIT accredited by IET UK?,Yes. 8 engineering programs hold IET-UK accreditation. Students get global engineer membership.
What's KIIT's design school ranking?,NIFT 2024 ranks School of Design 12th nationally. B.Des program has 100% placement since 2020.
How does KIIT rank in rural management?,Ranked 9th in India (NIRF 2024). MBA-RM includes 6-month fieldwork in 50+ tribal villages.
What's KIIT's AISHE ranking?,"All India 18th in AISHE 2023 enrollment. 35,000+ students across 28 schools."
Is KIIT part of UGC 12B?,Yes. UGC 12(f) and 2B status. Eligible for central government grants and research funding.
What's KIIT's AICTE-CII ranking?,Industry interface ranked 5th in AICTE-CII 2024. 200+ MoUs with companies like TCS and Siemens.
How does KIIT rank in cybersecurity?,Ranked 538th globally for Data Science (EduRank 2025). NSDC-certified courses in cybersecurity.
What's KIIT's THE Emerging Economies rank?,301-350 in THE Emerging Economies 2024. Top Indian private university in the list.
Is KIIT recognized by PMC?,KIMS Medical College listed in WHO Avicenna Directory. MBBS valid for USMLE/PLAB exams.
What's KIIT's NIRF pharmacy ranking?,B.Pharma ranked 45th in India (NIRF 2024). PCI approved with 1-year mandatory industry internship.
How does KIIT rank in student diversity?,12% international students from 65 nations. Ranked 58/100 in THE Diversity Index 2024.
What's KIIT's QS Graduate Employability?,QS Graduate Employability Rank 2025: 251-300. 95% placement rate with average 竄ｹ8 LPA.
Is KIIT part of the Washington Accord?,Yes. NBA Tier-1 accreditation under Washington Accord until 2026. Global engineering recognition.
What's KIIT's architecture faculty ranking?,ARCASIA Faculty Excellence Award 2024. 45 faculty with international PhDs and industry experience.
How does KIIT rank in legal education?,NIRF Law 2024: 19th in India. Moot court teams won 43 national competitions in 2024.
What's KIIT's AICTE feedback score?,4.8/5 in AICTE Student Satisfaction Survey 2024. Top in infrastructure and industry exposure.
Is KIIT recognized for Ph.Ds?,UGC-entitled Ph.D programs in 42 disciplines. 1200+ scholars with 85% publication rate.
What's KIIT's NIRF overall ranking trend?,Improved from 32nd (2023) to 28th (2024) in NIRF Overall. Target Top 20 by 2026.
How does KIIT rank in corporate relations?,Ranked 7th in India Today B-School 2024 for industry interface. 700+ recruiters on campus.
What's KIIT's Incubation success rate?,TBI Incubator: 80% startup survival rate. 12 unicorns launched including AI healthtech firm Medisim.
Is KIIT part of the Erasmus Mundus?,Yes. 15 fully-funded EU scholarships annually for student/faculty exchange programs.
What's KIIT's NPTEL local chapter rank?,No.1 NPTEL Local Chapter in East India. 50+ gold medalists in NPTEL exams since 2020.
How does KIIT rank in social impact?,THE Impact Ranking 2024: 201-300. 5% tuition revenue funds KISS tribal education initiatives.
What's KIIT's IPR ranking?,Ranked 594th globally in Intellectual Property Law (EduRank 2025). 250+ patents filed annually.
Is KIIT recognized by the Bar Council?,Yes. BA LLB program approved by Bar Council of India. 100% internship in High Courts.
What's KIIT's NIRF graduation outcome?,Scored 78.45/100 in NIRF Graduation Outcome 2024. 85% alumni in Fortune 500 companies.
How does KIIT rank in renewable energy?,THE Impact Ranking SDG7: 151-200. Campus runs on 85% solar with 8.9MW capacity.
What's KIIT's AISHE enrollment?,"35,412 students enrolled (AISHE 2023). 45% female enrollment with 12% international diversity."
Is KIIT part of the Commonwealth?,Yes. Commonwealth Universities Association member since 2015. Valid for Chevening scholarships.
What's KIIT's NIRF inclusivity score?,72.11/100 in NIRF Inclusivity 2024. 25% seats reserved for SC/ST/OBC with fee waivers.
How does KIIT rank in student-faculty ratio?,"15:1 ratio as per NIRF 2024. 3,000+ faculty with 45% holding international PhDs."
What's KIIT's QS Stars rating?,QS Stars 2025: 4-Star for Teaching and Facilities. 5-Star for Inclusiveness and Social Responsibility.
Is KIIT recognized by the MHRD?,Yes. Declared 'Institution of Eminence' in 2020. Receives 竄ｹ100cr annual grant for research.
What's KIIT's THE Young University rank?,"168th in THE Young University Rankings 2024. Founded in 1992, among top 200 young global universities."
How does KIIT rank in rural outreach?,NIRF Outreach 2024: 68.9/100. 500+ villages adopted for tech education under Unnat Bharat Abhiyan.
What's KIIT's AICTE feedback on labs?,4.9/5 in AICTE Lab Infrastructure Audit 2024. 竄ｹ500cr invested in smart labs with IoT/AI tools.
Is KIIT part of the IAU?,Yes. International Association of Universities member since 2008. Holds ISAS accreditation.
What's KIIT's NIRF perception score?,48.67/100 in NIRF Perception 2024. Recent controversies impacted employer/peer review scores.
How does KIIT rank in alumni networks?,"Alumni Impact Rank 4008 globally (EduRank 2025). 50,000+ alumni with 15 city chapters worldwide."
What's KIIT's recent controversy impact?,2025 Nepali student incident led to NIRF perception score drop. Ongoing reforms in grievance redressal.
Is KIIT's NBA accreditation valid?,Yes. 13 B.Tech programs hold valid NBA Tier-1 until 2026. Mechanical Engg accredited since 2005.
What's KIIT's THE Teaching score?,58.3/100 in THE Teaching 2024. 85% faculty with PhDs. 15:1 student ratio as per UGC norms.
How does KIIT rank in cultural festivals?,"KIIT Fest ranked Asia's 2nd largest cultural fest. 50,000+ participants from 65 countries annually."
What's KIIT's ARIIA innovation score?,86/100 in ARIIA 2021. 45 innovation labs including IoT Park and 3D printing facilities.
Is KIIT recognized for yoga studies?,School of Yoga ranked 5th nationally. Offers PhD in Yoga Therapy with WHO collaboration.
What's KIIT's NIRF research funding?,竄ｹ125cr external funding in 2023-24. DST/DBT funded projects on AI in healthcare and clean energy.
How does KIIT rank in student exchange?,THE International Outlook: 58/100. 500+ students sent abroad annually via Erasmus/SAARC programs.
What's KIIT's recent public perception?,Mixed reviews post-2025 protests. 4.3/5 on Shiksha with safety concerns raised in Reddit threads.
Is KIIT's ABET accreditation renewed?,Yes. Computer Science ABET reaccredited until 2029. Meets global engineering education standards.
What's KIIT's NIRF faculty quality?,78.45/100 in Faculty Quality (NIRF 2024). 45% faculty from IITs/IISc with industry experience.
How does KIIT rank in smart campus?,"Ranked 12th in India Today Smart Campus 2024. RFID attendance, AI security, and digital classrooms."
What's KIIT's QS Employability Award?,QS Employability Star 2025. 95% placement rate with highest package 竄ｹ63 LPA at Amazon.
Is KIIT part of the Paris Agreement?,Carbon-neutral campus since 2022. Part of UNFCCC Climate Neutral Now initiative.
What's KIIT's NIRF infrastructure score?,"92.11/100 in Infrastructure (NIRF 2024). 竄ｹ2,000cr invested in 25,000-bed hostels and smart labs."
How does KIIT rank in entrepreneurship?,"Ranked 1st in ARIIA 2021. 1,200+ student startups with 竄ｹ500cr cumulative valuation."
What's KIIT's recent THE ranking change?,Maintained 601-800 band in THE 2024. Improved research score by 12% but perception dropped 8%.
Is KIIT's architecture program COA approved?,Yes. B.Arch accredited by Council of Architecture. 100% placement in firms like Morphogenesis.
What's KIIT's response to recent controversies?,Established 24/7 international student cell. Partnered with Nepali Embassy for grievance redressal.
How does KIIT rank in global partnerships?,300+ MoUs with universities like MIT and Stanford. 15 joint degree programs offered.
What is KIIT's Central Advanced Research Centre (CARC)?,"130,000 sq.ft multidisciplinary facility with 25 labs, established in 2008. Houses advanced equipment like HPLC, GCMS, and fermentation systems."
How many patents has KIIT filed?,"810+ patents filed across disciplines. 45 granted in 2024 alone, focusing on AI healthcare and renewable energy technologies."
What is KIIT-TBI's incubation capacity?,Incubated 260+ startups since 2008. 87 graduated companies raised 竄ｹ500cr+ funding. Current capacity: 130 startups/year across 1.3L sq.ft.
Which funding agencies support KIIT research?,"DST, DBT, MeitY, Swedish Research Council, and Karolinska Institute. 100+ active projects with 竄ｹ200cr+ annual funding."
What are KIIT's Scopus publication stats?,"13,636+ Scopus-indexed papers. h-index 121. Top 5% global contributors in Biotechnology and Computer Science."
What is the Visvesvaraya PhD Scheme at KIIT?,"MeitY-funded program offering 竄ｹ38,750-43,750/month fellowships. 7 scholars in ECE/CS since 2023. Includes 竄ｹ1.2L/year research grants."
Which companies collaborate with KIIT-TBI?,"Thermo Fisher Scientific, Boeing, NRDC. Recent projects include drone AI with Odisha Police and WASH innovations with GIZ."
What are KIIT's focus research areas?,"AI healthcare, antimicrobial resistance, CAR T-cell therapy, smart materials, and renewable energy systems."
How does KIIT support biotechnology research?,School of Biotechnology runs 12 DST/DBT projects. Recent 竄ｬ2M grant from Karolinska Institute for antibiotic resistance studies.
What awards has KIIT-TBI won?,"AABI Best Asia Incubator (2023), BioSpectrum Bioincubator Award, LEX FALCON Global IP Award for tech transfer."
What is the KIIT-TBI Fab Lab?,"62,000 sq.ft fabrication lab with 3D printers, CNC machines. Used by 45 hardware startups for prototyping."
How many conferences does KIIT host annually?,"50+ national/international events. Hosted 2024 Global IP Convention with 1,200+ participants from 60 countries."
What is KIIT's industry collaboration model?,"18 Centers of Excellence with Siemens, ISRO, SKF. Joint projects on IoT, aerospace, and green engine technologies."
What research facilities exist for PhD scholars?,"24/7 access to CARC labs, 竄ｹ25k/year institutional overhead grants, and cloud computing clusters with 10PB storage."
How does KIIT promote student research?,Undergrads get 竄ｹ5L innovation grants. 120+ published in Q1 journals annually. Mandatory research credits in curriculum.
What is KIIT's IP commercialization rate?,"35% patent commercialization through TBI-TTO. 12 startups licensed technologies in 2024, generating 竄ｹ18cr revenue."
Which international universities partner with KIIT?,"Hannover (Germany), West Virginia (USA), SRH Hochschule. 15 joint PhD programs and 50+ faculty exchanges/year."
What is the h-index of KIIT in Web of Science?,"h-index 101 with 8,404 WoS publications. Top 1% citations in Materials Science and Environmental Engineering."
How many research scholars does KIIT have?,"1,200+ full-time PhD scholars. 45% funded through national schemes like DST-INSPIRE and UGC-NET."
What is KIIT's annual research budget?,"竄ｹ250cr+ annual R&D expenditure. 60% from external grants, 40% institutional funding. 15% YoY growth since 2020."
What is the KIIT-TBI NABL lab?,"ISO 17025 certified testing facility. Offers 150+ analytical services to startups. Processed 2,300+ samples in 2024."
Which journals are published by KIIT?,"KIIT Journal of Management, Kalinga Journal of Computer Science. Both Scopus-indexed with 12 annual issues."
What is the Nobel Lecture Series at KIIT?,"Annual event since 2015. 7 Nobel laureates delivered talks, including 2024 Chemistry laureate on CRISPR tech."
How many KIIT faculty have international PhDs?,"45% faculty hold PhDs from Top 200 QS universities. 120+ completed postdocs at MIT, Stanford, Max Planck."
What is KIIT's ranking in ARIIA?,1st among private universities in ARIIA 2024. Scored 92/100 for innovation ecosystem and industry partnerships.
What is the KIIT-TBI LEX FALCON award for?,Excellence in IP commercialization (2024). Recognized 12 tech transfers generating 竄ｹ50cr+ revenue.
Which govt schemes support KIIT startups?,"NIDHI, BIRAC BIG, MeitY TIDE 2.0. 45 startups received 竄ｹ25cr+ funding through these in 2024."
What is KIIT's COVID research contribution?,Developed RT-PCR kits approved by ICMR. Published 127 papers on pandemic management in Scopus Q1 journals.
How many KIIT papers are in top journals?,23% publications in Q1 journals (2024). 45 papers in Nature/Science indexed supplements last year.
What is the KIIT-TBI Rural Innovation Program?,Supports 50 agritech startups annually. 2024 projects include AI soil sensors and drone-based crop monitoring.
What is KIIT's DST-TEC facility?,Technology Enabling Centre with 竄ｹ15cr grant. Mentored 75 student projects in AI/ML and IoT in 2024.
How does KIIT support women researchers?,30% seats reserved in PhD programs. 15 crﾃｨche facilities. 12 women-led startups funded through TBI in 2024.
What is KIIT's Industry 4.0 research focus?,"SKF-KIIT Reliability Centre, Smart Manufacturing Lab. 45 patents filed in predictive maintenance tech."
What is the KIIT-Boeing BUILD program?,Aerospace innovation initiative since 2020. Funded 12 drone startups with 竄ｹ5cr seed grants.
How many KIIT projects address SDGs?,68% research aligned with UN SDGs. THE Impact Ranking 201-300. Top performer in SDG7 (Affordable Energy).
What is KIIT's High Performance Computing setup?,"200+ node cluster with 5 petaflops capacity. Used for genomics, climate modeling, and AI research."
Which KIIT departments have ABET accreditation?,Computer Science and IT programs accredited until 2029. Meets global engineering education standards.
What is KIIT's publication growth rate?,18% YoY increase in Scopus papers. 45% publications involve international co-authors from 50+ countries.
How many KIIT startups focus on healthcare?,35% TBI incubatees in healthtech. Notable graduate: Elmentoz Research (竄ｹ10cr revenue in CAR-T therapy).
What is the KIIT-TBI International Fellowship?,7-month LIF Global program with UK partners. 12 startups selected for ﾂ｣50k grants and mentorship.
What is KIIT's renewable energy research?,8.9MW solar campus. 15 DST projects on green hydrogen. 2024 innovation: perovskite solar cells with 28% efficiency.
How many KIIT faculty are IEEE Fellows?,12 IEEE Fellows. 45+ chair IEEE conferences annually. Top 10% contributor to IEEE Xplore in India.
What is KIIT's AI research output?,"4,200+ Scopus papers since 2020. 15 patents in NLP and computer vision. Collaborates with NVIDIA on GPU research."
What is the KIIT-TTO's role?,Technology Transfer Office filed 120+ IPs in 2024. Licensed 45 technologies to MSMEs. Revenue share 70% to inventors.
How many KIIT projects use IoT?,28% research involves IoT applications. ISRO-KIIT Satellite Centre launched 2 nanosatellites for agricultural monitoring.
What is KIIT's materials science focus?,"Thin film photovoltaics, graphene synthesis. 15 DAE-BRNS projects with 竄ｹ12cr funding for nuclear materials."
What is the KIIT-ISRO collaboration?,Joint satellite development since 2018. Current project: Hyperspectral imaging satellite for Odisha coastal monitoring.
How many KIIT startups export products?,22 TBI graduates export to 15 countries. Qualivon Technologies supplies IoT devices to EU and ASEAN markets.
What is KIIT's nanotechnology research?,Clean Room labs (Class 1000) for nano fabrication. 8 DST-Nanomission projects on drug delivery systems.
How does KIIT support AI startups?,"TBI's AI Garage provides free GPU access. 45 startups incubated, including 5 in NVIDIA Inception program."
What is KIIT's CAR T-cell therapy research?,竄ｹ5cr DBT project on hematologic cancer treatment. Phase II trials show 78% remission rate in 2024 studies.
What is the KIIT-TBI Mentorship Network?,"500+ industry experts including 15 CXOs. 1,200 mentorship sessions conducted annually for startups."
How many KIIT projects use blockchain?,"18 DST-funded blockchain projects. Applications in supply chain, healthcare. 7 patents filed in 2024."
What is KIIT's robotics research output?,Ranked 3rd nationally in RoboCup 2024. 45 papers on humanoid robotics in IEEE journals last year.
What is the KIIT-TBI Seed Fund?,竄ｹ50L-2cr grants for early-stage startups. 12 companies received 竄ｹ15cr total in 2024. Equity-free support.
How many KIIT faculty have industry experience?,60% faculty consulted for corporates. Average 8 years industry exposure. 45 joint patents with companies.
What is KIIT's 5G research contribution?,MeitY-funded 6G testbed development. 15 patents filed on beamforming tech. Partners include Ericsson and Jio.
What is the KIIT-TBI Bioincubator?,"NABL-certified labs for biotech startups. 35 companies incubated, including 7 in CAR-T and mRNA vaccine tech."
How many KIIT projects address climate change?,28 DST/UNEP funded projects. 2024 innovation: AI-powered carbon capture system with 92% efficiency.
What is KIIT's contribution to precision agriculture?,"TBI's AgriTech Vertical supports 25 startups. 2024 product: IoT soil health monitor used in 5,000+ farms."
What is KIIT's semiconductor research?,Visvesvaraya PhD scholars developing GaN chips. Collaboration with TSMC on 3nm node packaging tech.
How many KIIT startups focus on edtech?,15% incubatees in edtech. 2024 success: VR classroom platform adopted by 200+ schools nationwide.
What is KIIT's space tech research?,ISRO-KIIT Centre launched 3 CubeSats. Current project: Lunar regolith analysis for Chandrayaan-4 mission.
What is the KIIT-TBI Women Entrepreneurship Cell?,Funded 45 women-led startups since 2020. 2024 cohort raised 竄ｹ12cr. Provides childcare support and networking.
How many KIIT projects use machine learning?,68% CS research involves ML. 12 DST projects on explainable AI. Published 420 Scopus papers in 2024.
What is KIIT's automotive research?,BAJA SAE team ranked 4th nationally. Green Engine Centre developed hydrogen ICE with 40% efficiency.
What is the KIIT-TBI Corporate Innovation Program?,Connects 50+ corporates with startups. 2024 deals: Tata Steel adopted 3 IoT solutions from incubatees.
How many KIIT faculty are Highly Cited Researchers?,8 faculty in Clarivate's 2024 list. Top 1% citations in Materials Science and Computer Vision.
What is KIIT's cybersecurity research?,NSDC-certified courses. 15 DST projects on blockchain security. Developed AI threat detection tool for banks.
What is the KIIT-TBI Accelerator Program?,"6-month growth program for Series A startups. 2024 cohort: 12 companies, 竄ｹ150cr total valuation."
How many KIIT projects address water scarcity?,10 DST projects on smart water management. 2024 innovation: Atmospheric water generator using solar adsorption.
What is KIIT's contribution to UAV tech?,IG Drones (incubatee) deployed 200+ AI drones for Odisha disaster management. Exports to 7 countries.
What is KIIT's AI ethics research?,Mandatory course 'Responsible AI' for tech students. 8 papers on algorithmic bias mitigation in 2024.
How many KIIT startups use AR/VR?,25+ companies in TBI Metaverse Lab. 2024 product: Surgical training simulator adopted by AIIMS.
What is KIIT's food tech research?,3 DBT projects on fortified foods. 2024 patent: Edible coating extending fruit shelf life by 300%.
What is the KIIT-TBI International Market Access?,Helped 35 startups enter EU/US markets. 2024 export revenue: 竄ｹ85cr. Partners include UK India Tech Cluster.
How many KIIT faculty hold DST grants?,120+ faculty with SERB/DST grants. Average funding 竄ｹ50L/project. 15 Ramanujan Fellows in 2024.
What is KIIT's smart city research?,28% Civil Engg projects on urban tech. 2024 innovation: Self-healing concrete with 95% crack reduction.
What is the KIIT-TBI Student Innovation Fund?,"竄ｹ5L grants for undergrad projects. Funded 45 ideas in 2024, including AI stethoscope and solar desalination."
How many KIIT projects involve international collaboration?,55% research has global partners. 12 Horizon Europe projects with 竄ｬ25M total funding.
What is KIIT's contribution to telemedicine?,Developed AI diagnostic tool used in 150+ rural clinics. Funded by DBT under National Health Mission.
What is the KIIT-TBI Investor Network?,Connects startups with 250+ VCs. 2024 deals: 竄ｹ220cr raised by incubatees. Top investor: Sequoia Surge.
How many KIIT patents are commercialized?,18% patents licensed to industry. 2024 revenue: 竄ｹ12cr. Top product: IoT-based smart transformer monitoring.
What is KIIT's neuroscience research?,KIMS neurology dept published 45 papers on Parkinson's. DBT-funded project on AI brain implant control.
What is the KIIT-TBI Social Impact Challenge?,Annual competition with 竄ｹ50L prize. 2024 winner: Low-cost prosthetic limb using 3D printing tech.
How many KIIT projects use quantum computing?,8 DST-funded quantum projects. Collaboration with IBM on Qiskit. 2024 patent: Quantum encryption for 6G.
What is KIIT's textile innovation?,School of Fashion Tech developed self-heating fabric. Collaborates with Arvind Mills for commercial production.
What is the KIIT-TBI Alumni Angel Network?,75 alumni investors pledged 竄ｹ100cr. Funded 12 startups in 2024 including drone delivery service AeroX.
How many KIIT faculty are SASTRA awardees?,12 faculty received national awards. 3 Shanti Swarup Bhatnagar laureates in Biotechnology and Chemistry.
What was KIIT's highest placement package in 2024?,The highest package offered during 2024 placements was 竄ｹ63 LPA by Yugabyte for a BTech CSE student. 15 students received offers above 竄ｹ30 LPA according to official reports.
What is the average placement package for BTech students?,Average package for BTech stood at 竄ｹ8.5 LPA in 2024. Computer Science averaged 竄ｹ9.2 LPA while Civil Engineering reported 竄ｹ5.8 LPA as per CollegeDekho data.
How many companies participated in 2024 placements?,"700+ recruiters visited campus including 75 new companies. Top employers were Amazon, Accenture, Deloitte, and TCS according to KIIT's placement report."
What percentage of students get placed annually?,"Official 2024 reports claim 83.06% placement rate. However, Reddit discussions suggest 70-80% actual placement excluding higher studies and gap years."
Which departments have the best placement records?,"Computer Engineering (95% placed), Electronics (89%), and Mechanical (82%) lead placements. Biotechnology averages 65% due to higher PG pursuit as per Shiksha."
Are international placements available?,"42 students secured overseas offers in 2024, primarily in UAE and Singapore. Average international package was 竄ｹ18 LPA according to KIIT's international cell."
What controversy affected 2025 placements?,A 2025 incident involving Nepali student protests led to 12% drop in international recruiters. NIRF perception score fell to 48.67/100 as per latest rankings.
How does KIIT handle internship opportunities?,"Mandatory 2-month summer internships with 1500+ paid positions annually. Top providers: HighRadius (竄ｹ14k/month), Cognizant, and Capgemini through campus drives."
What is the PPO conversion rate?,30% of interns receive Pre-Placement Offers. HighRadius leads with 850+ PPOs in 2024 at 竄ｹ8 LPA as per KIIT-TBI collaboration reports.
Which companies offer the most internships?,"HighRadius (2200 interns), Cognizant (700+), and Wipro (450+) dominated 2024. 65% internships converted to PPOs according to placement cell data."
How strong is the alumni network for placements?,"1,00,000+ alumni provide referrals through KIITAA. 15 city chapters host placement drives - 12% 2024 offers came via alumni connections per Shiksha."
What placement support services exist?,Dedicated CDC with 45 counselors conducts 50+ mock interviews/week. Uses IBM Watson for personality mapping and LinkedIn profile optimization.
Are there placement guarantees in KIIT?,"No official guarantees. 7-day money-back policy exists if placements fail, but students report difficulties claiming it as per Reddit discussions."
How many students get multiple offers?,"1,200+ students received 2-3 offers in 2024. Record holder secured 9 offers totaling 竄ｹ1.2 crore CTC from companies like Amazon and Microsoft."
What's the placement scenario for MBA students?,KIIT SOM reported 331 offers with 竄ｹ9 LPA average. Top recruiter KPMG offered 竄ｹ19.35 LPA. 25% students opted for startup roles as per 2024 data.
How effective are the training programs?,800-hour mandatory training includes LeetCode grind and GD/PI sessions. Students report 40% improvement in offer rates post-training as per CDC surveys.
What's the gender-wise placement ratio?,Female students achieved 87% placement vs 81% male. Tech roles show 2:1 male dominance while consulting roles have 60% female placement as per 2024 reports.
Are there placement bonds or fees?,"No placement bonds. 竄ｹ5,000 placement fee charged for logistics. Optional 竄ｹ25k premium training for high-package companies as per student handbook."
