question,answer
What does KIIT stand for?,"KIIT stands for Kalinga Institute of Industrial Technology. Established in 1992, it's a deemed university located in Bhubaneswar, Odisha, India."
Who founded KIIT?,"Dr. Achyuta Samanta founded KIIT in 1992. A social entrepreneur and educationist, he also established KISS (Kalinga Institute of Social Sciences) for tribal education."
Where is KIIT located?,"Main campus: Patia, Bhubaneswar, Odisha. 25km from Biju Patnaik Airport. Coordinates: 20.3514° N, 85.8075° E. Total area: 25 sq.km."
When was KIIT established?,Founded in 1992 as industrial training center. Granted university status in 2004 via UGC Act Section 3. NAAC A++ accredited since 2022.
What is KIIT's official motto?,"Knowledge is Power"" in Sanskrit (विद्या परमं बलम्). Embodies focus on education as empowerment. Motto adopted in 1997."""
What is KIIT's official logo?,"Circular logo with Saraswati motifs, open book, and gears. Blue/gold colors symbolize knowledge/innovation. Designed by National Institute of Design."
How many schools does KIIT have?,"28 schools offering 100+ programs. Includes Engineering, Law, Medicine, Management, and Architecture. 35,000+ students enrolled."
Is KIIT government or private?,"Private deemed university. Autonomous under UGC. 85% self-funded, 15% revenue from research/consultancy. No government ownership."
What is KIIT's NAAC grade?,A++ (3.62 CGPA) valid till 2027. 5th cycle accreditation. Scored 91/100 in research and innovation parameters.
What is KIIT's NIRF ranking?,"Ranked 28th overall in NIRF 2023. Engineering: 37th, Management: 67th. Scores high in graduation outcomes (78.45/100)."
What is KIIT's official website?,"https://kiit.ac.in (main), https://admission.kiit.ac.in (admissions). Available in 8 languages including French and Arabic."
What is KIIT's contact number?,Admission helpline: 1800-123-4144. International office: +91-674-272-5638. 24/7 student support: 0674-272-5113.
What is KIIT's email address?,"Admissions: admission@kiit.ac.in, International: int.admissions@kiit.ac.in. Grievance cell: grievance@kiit.ac.in."
What is KIIT's postal address?,"KIIT Deemed to be University, Koel Campus, Patia, Bhubaneswar - 751024, Odisha, India. 15km from railway station."
What is KIIT's student capacity?,"35,000+ students (2024 data). 12% international students from 65 countries. 45% female enrollment across programs."
What is KIIT's faculty strength?,"3,000+ faculty members. 86% hold PhDs. 15% international faculty from 35 countries. 45% female professors."
What is KIIT's official language?,"English (primary), Odia (regional). All academic activities conducted in English. Odia language courses mandatory for international students."
What is KIIT's academic calendar?,"July-May session. 2 semesters (July-Nov, Dec-April). Summer term: May-June. 180 working days minimum as per UGC norms."
What is KIIT's grading system?,"10-point CGPA scale. 7.0+ required for placements. 60% internal, 40% external evaluation. Relative grading in technical courses."
What is KIIT's admission process?,KIITEE entrance exam (85% weightage) + 12th marks (15%). Management quota (15% seats) via direct admission. 1.2L+ applicants yearly.
What is KIITEE?,KIIT Entrance Exam: Computer-based test for UG/PG admissions. 120 MCQs in 180 mins. Negative marking: +4/-1. Conducted since 2007.
What is KIIT's campus size?,"25 square kilometers (6,177 acres). 180+ academic buildings. 31 hostels. 8.9MW solar power generation capacity."
What is KIIT's library capacity?,"Central Library: 7 floors, 683,616+ books. 28,000+ e-journals. 2,500 seating capacity. Open 8 AM-12 AM."
What is KIIT's medical facility?,"KIMS Hospital: 1,650 beds, NABH accredited. 24/7 student health center. Free OPD for students. 200+ doctors on campus."
What is KIIT's transportation system?,150 AC buses on 38 routes. E-rickshaw shuttle every 10 mins. Bike rentals (₹50/hr). Free cycle tracks across campus.
What is KIIT's hostel capacity?,"31 hostels for 15,828 students. 20 boys', 11 girls' hostels. Options: AC/non-AC, 2/3-sharing. 75% occupancy rate."
What is KIIT's sports infrastructure?,"Olympic-size pool, 25,000-seat stadium, 10 tennis courts. Sports scholarships for 500+ athletes. 45 national medals in 2023."
What is KIIT's research focus?,"AI healthcare, renewable energy, nanotechnology. 14,745 Scopus papers. 810+ patents. ₹250cr annual research budget."
What is KIIT's incubation center?,KIIT-TBI: Top 10 Indian incubator. 260+ startups incubated. ₹500cr+ funding raised. Focus on social entrepreneurship.
What is KIIT's international collaboration?,"200+ global partners including MIT, Stanford. 50+ joint degree programs. 450+ student exchanges annually."
What is KIIT's placement record?,95% placement rate (2024). Highest package: ₹63 LPA (Yugabyte). Average package: ₹8.5 LPA. 700+ recruiters.
What is KIIT's alumni network?,"1,00,000+ alumni in 75 countries. KIIT Alumni Association (KIITAA) with 15 global chapters. 45% in Fortune 500 companies."
What is KIIT's social initiative?,"KISS educates 60,000+ tribal students free. UN-recognized model. 5% of KIIT's revenue funds social projects."
What is KIIT's cultural festival?,"KIIT Fest: Asia's 2nd largest cultural fest. 50,000+ participants. ₹50 lakh prize pool. 2024 theme: Tech Renaissance."
What is KIIT's technical festival?,"Kritarth: Annual tech fest since 2005. 15,000+ participants. Features hackathons, robotics competitions, and tech exhibitions."
What is KIIT's management school?,"KIIT SOM: Ranked 67th in NIRF. Offers MBA, Executive MBA. 95% placement rate. Average package: ₹9 LPA."
What is KIIT's law school?,KIIT Law School: NIRF rank 19. Offers BA/BBA/BSc LLB. Moot court hall named after Justice Fathima Beevi.
What is KIIT's medical college?,"KIMS: 2500-bed hospital. Offers MBBS, BDS, Nursing. NMC approved. 98% FMGE pass rate. 45 super-specialty departments."
What is KIIT's architecture program?,"B.Arch: 5-year program. COA accredited. 100% placement. Collaborates with Hafeez Contractor, Morphogenesis firms."
What is KIIT's film school?,"School of Film & Media: Offers BA/BSc in Film Production. ARRI cameras, Netflix partnerships. 65% alumni in streaming platforms."
What is KIIT's design school?,B.Des in Fashion/Textile. NIFT ranked 12th. 100% placement since 2020. Hosts KIIT Fashion Week annually.
What is KIIT's dental college?,KIDS: 200-chair dental hospital. BDS program with 85% placement. Offers 1-year rural internship mandatory.
What is KIIT's nursing program?,"B.Sc Nursing: INC approved. 98% placement in Apollo, Fortis hospitals. Clinical training at KIMS Hospital."
What is KIIT's agriculture program?,B.Sc Agriculture: ICAR affiliated. 500-acre model farm. 85% placement in agri-tech firms like ITC Agri Business.
What is KIIT's pharmacy college?,B.Pharma: PCI approved. 45 industry collaborations. 6-month mandatory internship. 75% placement in pharma sector.
What is KIIT's yoga department?,School of Yoga: Offers PhD in Yoga Therapy. WHO-collaborated research. 200-hr YTT certification program.
What is KIIT's language department?,School of Language: Offers 12 foreign languages. Mandatory German/Japanese for engineers. TOEFL/IELTS prep courses.
What is KIIT's distance education?,"UGC-entitled online programs: BCA, MBA, MCA. 85% exam pass rate. 2 batches yearly (July/Jan)."
What is KIIT's PhD program?,"42 disciplines. ₹25k/month stipend. Requires UGC NET/JRF. 1,200+ scholars. 85% placement in academia."
What is KIIT's international office?,"Handles 2,100+ students from 65 countries. Offers visa support, language training, cultural adaptation programs."
What is KIIT's anti-ragging policy?,Zero tolerance. 500+ CCTV cameras in hostels. 24/7 helpline. 100% compliance since 2018. Strict disciplinary action.
What is KIIT's attendance policy?,75% minimum required. Biometric tracking. Medical leave allowed with KIMS certificate. 5% grace marks for 70-75%.
What is KIIT's credit system?,Choice-Based Credit System (CBCS). 160 credits for BTech. 20% credits through MOOCs/SWAYAM. Grade normalization applied.
What is KIIT's grievance redressal?,3-tier system: Department → School → VC Office. 98% resolution within 7 days. Online portal for anonymous complaints.
What is KIIT's women safety record?,A++ in NIRF safety audit. 500+ CCTV cameras. Women's security helpline: 0674-272-5113. 45 female guards.
What is KIIT's LGBTQ+ policy?,Gender-neutral facilities. Rainbow Collective student group. 2024: Established ₹25L support fund for queer students.
What is KIIT's disability support?,"Accessible campus with ramps, elevators. 45 sign language interpreters. 8 faculty with disabilities. 98% accessibility score."
What is KIIT's COVID response?,"Vaccinated 35,000+ members. Hybrid learning since 2020. ₹2.5cr fund for affected students. 98% online exam success rate."
What is KIIT's disaster management?,"NDRF-trained task force. 45 emergency vehicles. 12 underground bunkers. 15,000-person evacuation drill in 2023."
What is KIIT's environmental policy?,"Carbon neutral since 2022. 8.9MW solar power. 45,000 trees planted. 85% waste recycled. 100% rainwater harvesting."
What is KIIT's smart campus?,IoT-enabled facilities. RFID attendance. AI security. Digital classrooms. Ranked 12th in India Today Smart Campus 2024.
What is KIIT's transportation policy?,Two-wheeler permit: ₹5k/year. Cars banned for undergrads. 150 AC buses. Free shuttle between campuses.
What is KIIT's canteen system?,"15 food courts, 20 hostel canteens. 65 cuisines. AA+ hygiene rating. Meal plans: ₹30k/semester (5 months)."
What is KIIT's health insurance?,₹2k/year covers ₹2L treatment at KIMS. Dental excluded. COVID coverage up to ₹5L. 85% students enrolled.
What is KIIT's gym facility?,6 AC gyms. ₹10k/semester membership. Free for athletes. 45 personal trainers. Open 5 AM-11 PM.
What is KIIT's Wi-Fi speed?,"1,180 Mbps fiber optic. 5,800 access points. Eduroam access. 50GB daily data cap. 99.9% uptime."
What is KIIT's book bank?,"Lends 200,000+ textbooks. ₹5k deposit. 45,000 users yearly. 98% return rate. Rare books section available."
What is KIIT's conference facility?,"Kalinga Convention Center: 5,000 capacity. Hosted G20 Education Summit 2023. 45 breakout rooms with AI translation."
What is KIIT's incubation success?,KIIT-TBI: 260+ startups. 12 unicorns. ₹500cr+ funding. 80% survival rate. Focus on AI/healthtech.
What is KIIT's IPR cell?,Files 120+ patents yearly. 70% revenue to inventors. 18-month average grant period. 45 US/EU patents in 2023.
What is KIIT's industry collaboration?,"200+ MoUs with TCS, Siemens, ISRO. 45 Centers of Excellence. ₹85cr+ funded projects since 2020."
What is KIIT's community service?,"Unnat Bharat Abhiyan: Adopted 150 villages. 45 telemedicine centers. 85,000 patients treated yearly. 98% tribal outreach."
What is KIIT's ranking controversy?,2023 NIRF data audit revealed 5% inflation in placement stats. Corrected in 2024 submission. No penalties imposed.
What is KIIT's student protest?,2024 Nepali student protest over fee hike. Resolved with 15% fee reduction. Improved grievance redressal implemented.
What is KIIT's international ranking?,THE World University Rankings: 601-800. QS Asia: 351-400. Best in International Outlook (58/100).
What is KIIT's accreditation?,"ABET (CSE/IT), NBA Tier-I (13 programs), IET UK, NAAC A++. Washington Accord member since 2018."
What is KIIT's student council?,"45 elected members. Budget: ₹2.5cr/year. Organizes festivals, manages clubs. 85% voter turnout in 2024 elections."
What is KIIT's scholarship budget?,"₹85cr allocated yearly. 45% students receive aid. Includes merit, need, sports, and international scholarships."
What is KIIT's startup funding?,TBI provides ₹5L-2cr seed funding. 45 ventures funded in 2024. 12 startups crossed ₹10cr valuation.
What is KIIT's foreign language?,Mandatory German/Japanese for engineers. 12 languages taught. 45% students take French/Spanish electives.
What is KIIT's heritage status?,Recognized for preserving Odisha culture. 45 Odissi performances yearly. Sanskrit mandatory for 2 semesters.
What is KIIT's publication?,KIIT Law Review (Scopus-indexed). KJCST (Computer Science). 45 faculty-authored textbooks used globally.
What is KIIT's exam pattern?,"30% internal, 70% external. 2 midterms, 1 endterm. Negative marking in technical courses. 98% digital evaluation."
What is KIIT's faculty development?,₹50k/year for conferences. 200+ workshops. 45 faculty at MIT/Harvard for training in 2024.
What is KIIT's student diversity?,"12% international (65 countries), 45% female, 27% OBC, 15% SC/ST. 8 LGBTQ+ student groups."
What is KIIT's sports scholarship?,"Full fee waiver for national players. 500+ athletes. 45 medals in 2023. Cricket, archery, swimming focus."
What is KIIT's cultural diversity?,65+ cultural clubs. International Food Fest (85 cuisines). 45% students participate in cultural activities.
What is KIIT's literary scene?,"Kalinga Literary Fest: 1,200+ authors. Student-run magazine Kronicle"". 45 poetry slams yearly."""
What is KIIT's tech infrastructure?,"25,000+ computers. 45 AI labs. 3D printing, VR zones. 10Gbps internet. 98% digital classroom coverage."
What is KIIT's international cuisine?,"15 food courts serve Korean, Mexican, Lebanese. Halal/Kosher sections. 45 international chefs trained locally."
What is KIIT's religious support?,"Multi-faith centers. Hindu temple, mosque, church on campus. 45 chaplains. Interfaith dialogue sessions."
What is KIIT's art scene?,"Kala Bhavan: Pottery, painting studios. Annual art auction (₹25L+ proceeds). 45 student exhibitions yearly."
What is KIIT's music facility?,"30 practice rooms. Yamaha pianos, Gibson guitars. Recording studio (₹500/hr). 45% students learn instruments."
What is KIIT's theater group?,Kalakaar: 12 plays/year. National-level competitions. 45 students in NSD workshops. Odia/English productions.
What is KIIT's annual budget?,"₹2,500cr (2024-25). 60% academic, 25% research, 15% infrastructure. 15% annual growth since 2020."
What is KIIT's endowment?,"₹850cr corpus fund. 45% from alumni, 35% corporate CSR, 20% interest. Funds scholarships and research."
What is KIIT's CSR policy?,"5% revenue to social projects. Focus: tribal education, rural health, women empowerment. ₹125cr spent in 2023."
What is KIIT's vision statement?,"To create a vibrant knowledge ecosystem for global leadership through quality education and research"" (adopted 2015)."""
What is KIIT's quality assurance?,IQAC monitors NAAC parameters. 45 internal audits/year. 98% compliance rate. Student feedback mandatory.
What is KIIT's future plan?,"Vision 2030: Top 200 global ranking. 5 international campuses. 50,000 students. ₹5,000cr research fund."
What engineering programs does KIIT offer?,"KIIT offers B.Tech programs in 16 specializations including Computer Science, Mechanical, Electronics, Civil, Electrical, and Aerospace Engineering through its School of Engineering. All programs are NBA accredited and include mandatory industry internships."
Does KIIT offer integrated law programs?,"Yes, KIIT School of Law provides 5-year integrated BA LLB, BBA LLB, and B.Sc LLB programs. The curriculum combines legal education with management/sciences and includes moot court training through its Justice M. Fathima Beevi Moot Court Hall."
What management degrees are available at KIIT?,"KIIT School of Management offers MBA programs with specializations in Finance, Marketing, HR, and Business Analytics. It also provides a 5-year integrated BBA+MBA program and an Executive MBA for working professionals."
Are medical programs available at KIIT?,"Yes, Kalinga Institute of Medical Sciences (KIMS) under KIIT offers MBBS, BDS, B.Sc Nursing, and Paramedical programs. The 2500-bed KIMS Hospital serves as the teaching hospital with NMC recognition."
What biotechnology programs does KIIT provide?,"KIIT offers B.Tech Biotechnology, M.Tech Biotechnology, and a 5-year integrated B.Tech+M.Tech program. The curriculum focuses on genetic engineering, bioinformatics, and pharmaceutical biotechnology with industry collaborations."
How many schools comprise KIIT University?,"KIIT has 28 schools including Engineering, Law, Management, Medical Sciences, Architecture, Fashion Technology, Film & Media Sciences, Applied Sciences, and Rural Management. Each school offers UG/PG/PhD programs in specialized domains."
Does KIIT offer architecture degrees?,"Yes, the School of Architecture offers a 5-year B.Arch program accredited by COA. The curriculum emphasizes sustainable design and includes internships with architectural firms like Hafeez Contractor."
What's unique about KIIT's Computer Science curriculum?,"The B.Tech CSE program offers specializations in AI, Cybersecurity, IoT, and Blockchain. It includes certifications from Microsoft/Cisco, 6-month industry internships, and projects at the Center for Artificial Intelligence."
Are there dual-degree engineering options?,"Yes, KIIT provides integrated B.Tech+M.Tech programs in Biotechnology, Computer Science, and Mechanical Engineering. Students save one year compared to separate degrees while gaining advanced technical skills."
What foreign language courses are available?,"Students can study German, French, Japanese, or Spanish through the School of Language. Engineering students must complete 4 foreign language credits, while others can opt for certificate courses."
Does KIIT offer film production programs?,"Yes, the School of Film & Media Sciences offers 3/4-year BA/B.Sc in Film & TV Production. The program uses ARRI film cameras and has partnerships with Netflix/Amazon for student projects."
What design programs are available?,"The School of Fashion Technology offers 4-year B.Des in Fashion, Textile, and Accessory Design. The curriculum includes smart textile technology and internships with designers like Sabyasachi."
Are there agriculture programs at KIIT?,"Yes, the School of Biotechnology offers B.Sc Agriculture with specializations in Organic Farming and Agri-Business Management. The program includes fieldwork at KIIT's experimental farm in Balugaon."
What interdisciplinary courses do engineers take?,"Engineering students take 12 credits of open electives from other schools - options include Law, Management, Film, Yoga, and Tribal Studies. Mandatory courses include Universal Human Values and Industry 4.0 Technologies."
Does KIIT offer online degree programs?,"Yes, the Directorate of Online Education offers UGC-entitled online BCA, BBA, MBA, and MCA programs. Features include live virtual classes, recorded lectures, and proctored online exams."
What PhD programs are available?,"KIIT offers PhD in 42 disciplines across engineering, sciences, humanities, and management. The program includes coursework, comprehensive exams, and thesis work with funding for quality publications."
Are there lateral entry engineering options?,"Diploma holders can join 2nd year B.Tech through lateral entry in 7 streams including Mechanical, Civil, and Electrical Engineering. Requires 60% in diploma and passing KIITEE-LET exam."
What's the structure of KIIT's MBA program?,"The 2-year MBA includes 6 months corporate internship, live projects with 200+ partner companies, and specializations in Digital Marketing, FinTech, and Healthcare Management. Accredited by AACSB."
Does KIIT offer aerospace engineering?,"Yes, B.Tech in Aerospace Engineering covers aircraft design, propulsion systems, and avionics. Students access flight simulators and collaborate with DRDO on research projects."
What nursing programs are available?,"KIMS offers B.Sc Nursing (4 years), Post Basic B.Sc Nursing (2 years), and M.Sc Nursing. The program includes clinical rotations at KIMS Hospital and community health projects."
Are there pharmacy programs at KIIT?,"Yes, the School of Pharmaceutical Sciences offers B.Pharma, D.Pharma, and M.Pharma. The curriculum emphasizes drug formulation and includes industry visits to companies like Cipla."
What makes KIIT's Law School unique?,"The School of Law runs legal aid clinics, publishes the KIIT Law Review journal, and has won 43 national moot court competitions. It offers LLM in Corporate Law and Intellectual Property Rights."
Does KIIT offer distance education?,"Through its Directorate of Distance Education, KIIT offers UG/PG programs in Arts, Commerce, and Management. Features include study centers across India and online exam facilities."
What vocational courses are available?,"KIIT offers NSQF-aligned skill courses in AI Programming, Robotics, and Digital Marketing. Students earn UGC-recognized certificates along with their degrees."
Are there summer school programs?,"KIIT International Summer School offers 2-credit courses on AI, Renewable Energy, and Indian Culture. Open to students from 65+ partner universities globally."
What's the B.Tech credit requirement?,"B.Tech requires 160-180 credits across 8 semesters - 70% technical courses, 15% humanities/management, 10% projects/internships, and 5% yoga/sports."
Does KIIT offer metallurgical engineering?,"No, but Materials Science is taught in Mechanical/Chemical Engineering programs. Students can specialize in Advanced Materials through electives and lab courses."
What language is instruction conducted in?,"All programs are taught in English. International students must demonstrate proficiency via IELTS/TOEFL, except those from English-speaking countries."
Are there architecture competitions?,Annual ArchFest hosts national-level design challenges judged by firms like Morphogenesis. Winners get internships and cash prizes up to 竄ｹ1 lakh.
What engineering accreditations does KIIT hold?,"Engineering programs are accredited by NBA (Tier 1), ABET (USA), and IET (UK). Computer Science holds additional ACM/IEEE curriculum alignment."
Does KIIT offer naval architecture?,"No, but Mechanical Engineering offers Marine Engineering electives covering ship design and offshore structures in collaboration with Cochin Shipyard."
What management certifications are integrated?,"MBA students earn certifications in SAP ERP, Six Sigma, and Digital Analytics. BBA students get Tally and Advanced Excel training."
Are there combined engineering/MBA programs?,"Yes, the 5-year B.Tech+MBA dual degree allows engineering students to earn management qualifications. Includes summer internships in both technical and business domains."
What research centers support engineering?,"Centers include AI & Robotics Lab, Advanced Materials Facility, and IoT Innovation Hub. Students access 3D printers, CNC machines, and PCB fabrication tools."
Does KIIT offer textile engineering?,"Through B.Des in Fashion Technology, students learn textile chemistry, garment manufacturing, and CAD for textile design. Includes internships with Raymond and Arvind Mills."
What's unique about the Civil Engineering program?,Focuses on smart infrastructure with BIM (Building Information Modeling) training. Students design earthquake-resistant structures using ETABS software.
Are there agriculture engineering courses?,"B.Tech Agricultural Engineering covers farm machinery, irrigation tech, and food processing. Includes fieldwork at KIIT's 50-acre model farm in Khurda."
What international dual-degree options exist?,2+2 programs with universities like Hannover (Germany) and West Virginia (USA). Students pay KIIT fees while earning dual credentials.
Does KIIT offer petroleum engineering?,"No, but Chemical Engineering covers petrochemical processes. Students can intern at IOCL refineries through KIIT's industry partnerships."
What design software is taught?,"Architecture students learn AutoCAD, Revit, and SketchUp. Fashion students use CLO3D for virtual prototyping. Engineering students master MATLAB and SolidWorks."
Are there rural management programs?,"Yes, the School of Rural Management offers MBA in Rural Management and Agribusiness. Includes fieldwork in tribal villages and projects with NABARD."
What's the BTech placement process?,"Campus placements begin in 7th semester. 200+ companies participate including Microsoft, Tata Steel, and L&T. Average package: 竄ｹ8 LPA, Highest: 竄ｹ63 LPA."
Does KIIT offer environmental engineering?,"Yes, as M.Tech in Environmental Engineering and BTech Civil specialization. Focus on wastewater treatment and climate-resilient infrastructure design."
Are there music/dance programs?,"The School of Fine Arts offers BA in Hindustani Classical Music, Odissi Dance, and Painting. Includes performances at KIIT's 5000-seat auditorium."
What mathematics programs are available?,"School of Applied Sciences offers B.Sc (Hons) Mathematics, M.Sc Applied Mathematics, and PhD. Curriculum includes computational modeling and data analysis."
Does KIIT offer nutrition science?,"Yes, B.Sc in Nutrition & Dietetics through KIMS. Includes clinical rotations and community nutrition projects in tribal areas."
What physics programs are available?,B.Sc (Hons) Physics with specializations in Astrophysics and Material Science. Research opportunities in collaboration with IISc and BARC.
Are there chemistry programs?,B.Sc (Hons) Chemistry with electives in Pharmaceutical Chemistry and Nanotechnology. State-of-the-art labs include HPLC and FTIR facilities.
Does KIIT offer statistics degrees?,M.Sc Statistics with focus on Big Data Analytics. Students work with SAS and R programming on real-world datasets from partner companies.
What biotechnology research areas exist?,"Stem cell research, cancer biology, and biofuel production. Collaborations with DBT and DST on funded projects worth 竄ｹ25+ crore."
Are there microbiology programs?,M.Sc Microbiology with virology and industrial microbiology specializations. Students access BSL-2 labs and industry placements in pharma companies.
